Comments,Incident,Location,Occurred,Reported,Tag,approx_occurred,latitude,longitude
woman reports losing a canon power shot digital camera while in the quad,lost property,5810 s. university (quad),6/28/10 2:45 pm,7/1/10 12:42 pm,lost,2010-06-28 14:45:00,41.7892236,-87.5980197
unknown person smashed windshield of a rental truck parked in a vacant lot,criminal damage to vehicle,61st & drexel,6/29/10 to 7/1/10 3:00 pm to 1:50 pm,7/1/10 2:01 pm,,,41.7840731,-87.6043863
unknown person smashed rear passenger's side window of vehicle parked on the street and took a gps device,theft from motor vehicle,60th between ingleside & ellis,6/29/10 to 7/1/10 5:30 pm to 12:30 pm,7/1/10 2:48 pm,theft,,41.785901249999995,-87.60199659999999
bicycle taken from bike rack,theft,60th and ellis,6/23/10 to 6/29/10 9:00 am to 5:00 pm,7/1/10 3:13 pm,theft,,41.785973,-87.600983
"bottle slipped from man's hands, broke causing chemical to spill on his clothes, countertop and floor / safety notified / no injuries",chemical spill,924 e. 57th st. (bslc),7/1/10 6:15 pm,7/1/10 6:15 pm,,2010-07-01 18:15:00,41.791942,-87.602839
staff member reports losing wallet containing uc id while in a restaurant,lost property,"out of area - palos heights, il",7/1/10 10:00 pm,7/1/10 11:09 pm,lost,2010-07-01 22:00:00,41.66861859999999,-87.7841447
ucpd officers arrested two males for possession of marijuana,possession of cannabis,everett at 56th,7/1/10 11:50 pm,7/1/10 11:50 pm,,2010-07-01 23:50:00,41.79344529999999,-87.58206820000001
"a man, who appeared to be intoxicated, struck another man for no apparent reason / arrest",battery,maryland between 53rd & 54th,7/1/10 10:45 pm,7/1/10 10:45 pm,battery,2010-07-01 22:45:00,41.79770155,-87.60509585
"a group of youths knocked a man to the ground and took his cell phone, mp3 player and head phones",robbery,55th at kenwood,7/2/10 1:45 am,7/2/10 2:24 pm,robbery,2010-07-02 01:45:00,41.7950348,-87.5930176
man riding bicycle struck by a motor vehicle at the intersection / transported to hospital by cfd ems,injured person,55th at woodlawn,7/2/10 10:20 pm,7/3/10 12:45 am,,2010-07-02 22:20:00,41.7952617,-87.5967546
loud noise and music at a residence / peace restored,disturbance,university between 56th & 57th,7/3/10 2:05 am,7/3/10 2:05 am,,2010-07-03 02:05:00,41.7902573,-87.6007681
"woman walked out of main entrance, tripped over rug, fell injuring right knee / refused medical attention",injured person,5815 s. maryland (mitchell hosp.),7/3/10 1:20 pm,7/3/10 1:43 pm,,2010-07-03 13:20:00,41.7892116,-87.60406619999999
"unknown person took duffel bag, keys, and miscellaneous articles from a locked gym locker / lock also taken",theft,5530 s. ellis (ratner ac),7/3/10 4:00 pm to 5:00 pm,7/3/10 5:12 pm,theft,2010-07-03 16:30:00,41.7940762,-87.60170769999999
neighbors complained of people setting off fireworks / peace restored,disturbance,university between 56th & 57th,7/4/10 12:00 am,7/4/10 12:10 am,,2010-07-04 00:00:00,41.7902573,-87.6007681
small fire in trash can outside of eckhart hall / extinguished / cfd responded,fire,1118 e. 58th st. (eckhart hall),7/4/10 2:00 am,7/4/10 2:05 am,,2010-07-04 02:00:00,41.7895621,-87.601259
unknown male subject gained entry to residence via open window / suspect fled when confronted by occupant,attempt burglary,61st between ingleside & ellis,7/4/10 7:20 am,7/4/10 7:46 am,burglary,2010-07-04 07:20:00,41.7840933,-87.6019507
unknown person smashed passenger's side vent window of car parked on the street and took a gps device,theft from motor vehicle,midway pl. between cottage grove & drexel,7/5/10 7:00 am to 11:45 am,7/5/10 12:12 pm,theft,2010-07-05 09:22:30,41.77901015,-87.6769668
ucpd officers arrested a male for possession of an air pistol and theft of a bicycle,unlawful use of a weapon,58th at university,7/5/10 7:08 pm,7/5/10 7:12 pm,,2010-07-05 19:08:00,41.789927,-87.6028615
"unknown person(s) forced entry to vacant building being renovated and took new stoves, refrigerators and microwaves",burglary,ingleside between 51st & 52nd,7/3/10 to 7/6/10 2:00 pm to 7:00 am,7/6/10 10:50,burglary,,41.7889661,-87.60093189999999
unknown person took unattended echo gas hedge trimmer from the bed of a facilities atv,theft,5801 s. ellis (quad),7/6/10 11:15,7/6/10 13:13,theft,2010-07-06 11:15:00,41.7846534,-87.60485700000001
unknown person took an unattended mac book pro laptop computer from a study pod,theft,5811 s. ellis (cobb hall),7/6/10 12:35 pm to 12:55 pm,7/6/10 13:16,theft,2010-07-06 12:45:00,41.7932161,-87.59975829999999
staff member reports a person is constantly calling and harassing her via telephone at work,telephone harassment,6054 s. drexel (uc office bldg),7/6/10 7:40 am to 1:00 pm,7/6/10 16:09,,2010-07-06 10:20:00,41.7919788,-87.5983645
male performing an indecent act on the public way was observed and arrested by ucpd officers / also charged with failing to register new address as a sex offender,pubic indecency,greenwood at 56th,7/6/10 21:11,7/6/10 21:11,,2010-07-06 21:11:00,41.794451,-87.59861540000001
bicycle chained to bike rack taken,theft,5640 s. university (bartlett commons),7/2/10 to 7/6/10 4:00 pm to 6:15 pm,7/6/10 21:36,theft,,41.7837227,-87.590271
man ignored previous warnings arrested by ucpd for trespass,criminal trespass to property,5514 s. university (pierce hall),7/6/10 21:50,7/6/10 21:50,,2010-07-06 21:50:00,41.7953337,-87.6026998
alarm malfunction / cfd responded,fire alarm,6035 s. blackstone (chiller plant),7/7/10 5:27 am,7/7/10 5:27 am,,2010-07-07 05:27:00,41.7912628,-87.59920819999999
unknown person smashed passenger's side rear window of a car parked on the street,criminal damage to vehicle,ingleside at 55th,7/7/10 8:00 am to 12:00 pm,7/7/10 12:23 pm,,2010-07-07 10:00:00,41.7942127,-87.59339745
unknown person entered an unlocked room and removed a macbook computer from a cable lock,theft,1101 e. 57th st. (zoology),7/7/10 11:00 am to 12:45 pm,7/7/10 1:22 pm,theft,2010-07-07 11:52:30,41.7880092,-87.5987709
unknown person smashed window of car parked on the street and took a 35 lb. bag of dog food,theft from motor vehicle,hyde park between 55th & 56th,7/4/10 to 7/7/10  11:00 pm to 6:00 pm,7/7/10 6:17 pm,theft,,41.7846534,-87.60485700000001
man ignored previous warning and was arrested by ucpd for trespass,criminal trespass to property,1126 e. 59th st. (social science),7/8/10 2:27 pm,7/8/10 2:27 pm,,2010-07-08 14:27:00,41.7915946,-87.6022845
domestic situation involving custody of children,miscellaneous,6054 s. drexel (ucpd),7/8/10 5:50 pm,7/8/10 5:50 pm,,2010-07-08 17:50:00,41.797976000000006,-87.59580245
alarm triggered by leaking water heater / no fire,fire alarm,940 e. 57th st. (bio-psychological research),7/9/10 8:30 am,7/9/10 8:45 am,,2010-07-09 08:30:00,41.79680865,-87.60506709999999
male subject armed with a knife demanded and took money from a woman in a building vestibule and attempted to sexually assault her / arrest by ucpd,sexual assault,54th between woodlawn & kimbark,7/9/10 1:05 pm,7/9/10 1:09 pm,assault,2010-07-09 13:05:00,41.7927938,-87.59843049999999
unknown person(s) gained entry to apartment and took 2 laptop computers and a gameboy / no sign of forced entry,burglary,54th between cottage grove and drexel,7/9/10 9:30 am to 4:30 pm,7/9/10 4:42 pm,burglary,,41.7902573,-87.6007681
smoke detector malfunction / cfd responded,fire alarm,5630 s. university (max palevsky east),7/9/10 6:13 pm,7/9/10 6:13 pm,,2010-07-09 18:13:00,41.78986500000001,-87.6027639
complaint of people setting off fireworks / peace restored,disturbance,university between 56th & 57th,7/10/10 4:55 am,7/10/10 4:55 am,,2010-07-10 04:55:00,41.7915946,-87.6022845
researcher accidently spilled chemical substance / safety and cfd notified. cfd haz. mat. team responded / cleaned area.,hazardous material incident,920 e. 58th st. (cummings life science ctr.),7/10/10 1:35 pm,7/10/10 3:28 pm,,2010-07-10 13:35:00,41.7895805,-87.6009332
alarm malfunction / cfd responded,fire alarm,940 e. 57th st. (bio-psychological science),7/11/2010  12:07 am am,7/11/10 12:07 am,,2010-07-11 00:07:00,41.771438849999996,-87.6030459
apparent alarm malfunction / premise secure,activated alarm,5801 s. ellis (admin. building),7/11/10 4:42 am,7/11/10 4:42 am,,2010-07-11 04:42:00,41.7990955,-87.6014239
comed transformer in the alley sparked and caught fire / cfd extinguished / comed on scene,fire,62nd st. between drexel & ingleside,7/11/10 8:35 am,7/11/10 8:43 am,,2010-07-11 08:35:00,41.78963385,-87.5939875
a male acquaintance visiting a female forced sexual intercourse against her will,criminal sexual assault,53rd at ellis,7/11/10 2:10 pm,7/11/10 2:21 pm,assault,2010-07-11 14:10:00,41.792279,-87.599954
residents came home and found a male subject had broken into their apartment / suspect fled before police arrived,burglary,58th between kimbark & kenwood,7/11/10 8:20 pm,7/11/10 8:29 pm,burglary,2010-07-11 20:20:00,41.7901847,-87.60458489999999
male subject created a disturbance when a staff member told him it was too late to check out a book,disturbance,1100 e. 57th st. (regenstein library),7/11/10 9:50 pm,7/11/10 9:55 pm,,2010-07-11 21:50:00,41.7902573,-87.6007681
unknown person took17 files  from a file cabinet,theft,5721 s. maryland (comer hospital),7/9/10 2:00 pm to 7/12/10 5:30 am,7/12/10 7:37 am,theft,,41.794451,-87.59861540000001
neighbors complained of loud noisy party outside of a residence / peace restored,disturbance,university between 56th & 57th,7/13/10 12:35 am,7/13/10 12:35 am,,2010-07-13 00:35:00,41.7994594,-87.59501829999999
man climbing fence cut his wrist / transported to er by cfd ems,injured person,5514 s. university (pierce hall),7/13/10 2:20 pm,7/13/10 2:27 pm,,2010-07-13 14:20:00,41.7986154,-87.605121
unknown person scrawled graffiti on the side of a residential building,criminal damage to property,kimbark at 53rd,7/13/10 12:00 pm to 3:00 pm,7/13/10 4:57 pm,,2010-07-13 13:30:00,41.787735,-87.6012294
ucpd officers arrested a man wanted on a warrant,warrant arrest,53rd at maryland,7/13/10 6:16 pm,7/13/10 6:16 pm,,2010-07-13 18:16:00,41.7848161,-87.6015965
alarm malfunction due to a power outage,irregular conditions,1059 e. 59th st. (classics),7/14/10 6:54 am,7/14/10 6:54 am,,2010-07-14 06:54:00,41.791942,-87.602839
unknown person entered unsecured office and took unattended wallet left on a desk,theft,6030 s. ellis (edelstone center),7/13/10 2:00 pm to 4:00 pm,7/14/10 10:43 am,theft,2010-07-13 15:00:00,41.7912712,-87.59819279999999
plastic accidently placed in a sterilizer oven caused smoke / cfd responded,fire/smoke report,924 e. 57th st. (knapp center),7/14/10 12:33 pm,7/14/10 12:33 pm,,2010-07-14 12:33:00,41.788344,-87.60090319999999
three keys to the facility taken from an unattended key ring left in a mail box,theft,5706 s. university (reynolds club),7/13/10 to 7/14/10 6:30 pm to 10:00 am,7/14/10 6:23 pm,theft,,41.7935818,-87.5989697
sick person transported to er by cfd ems / treated and released,sick person,5845 s. ellis (gates-blake),7/15/10 8:41 am,7/15/10 8:41 am,,2010-07-15 08:41:00,41.7892116,-87.60406619999999
bicycle chained to bike rack taken by unknown person,theft,5550 s. university (crown field house),7/15/10 9:45 am to 12:45 pm,7/15/10 12:51 pm,theft,2010-07-15 11:15:00,41.7880702,-87.5956216
unknown person took wallet from a purse that was placed on the floor under the table while dining / unauthorized use of credit card subsequently reported,theft,5815 s. maryland (mitchell hospital),7/15/10 11:00 am to 12:55 pm,7/15/10 3:02 pm,theft,2010-07-15 11:57:30,41.7964345,-87.58999329999999
ucpd officer questioning suspicious male in ida noyes discovered subject possessed marijuana / arrest,possession of cannabis,1212 e. 59th st. (ida noyes),7/15/10 3:37 pm,7/15/10 3:37 pm,,2010-07-15 15:37:00,41.7919788,-87.5983645
woman freed from stuck elevator by cfd,stuck elevator,5455 s. blackstone (neighborhood res.),7/15/10 8:10 pm,7/15/10 8:12 pm,,2010-07-15 20:10:00,41.7785315,-87.5980675
during a premise check ucpd officer found exterior door not properly secured / premises checked and secured,irregular condition,5640 s. university (bartlett commons),7/16/10 12:42 am,7/16/10 12:42 am,,2010-07-16 00:42:00,41.7846534,-87.60485700000001
former staff member refused to return a macbook laptop computer when he was terminated,theft,6420 s. university (charter school),6/18/10 3:40 pm,7/16/10 9:10 am,theft,2010-06-18 15:40:00,41.80129910000001,-87.59530314999999
staff member complained of chest pains / transported to mitchell er by cfd ems,sick person,6054 s. drexel (ucpd),7/16/10 11:54 am,7/16/10 11:54 am,,2010-07-16 11:54:00,41.797963,-87.5966091
unknown person took bicycle chained to rear porch of residence,theft,cornell between 51st & 52nd,7/15/10 to 7/16/10 8:30 pm to 12:30 pm,7/16/10 1:49 pm,theft,,41.8408515,-87.66560634999999
bicycle chained to city stop sign taken by unknown person,theft,woodlawn at 54th,7/15/10 to 7/16/10 7:00 pm to 9:30 am,7/16/10 3:29 pm,theft,,41.7902573,-87.6007681
man walking on the street was attacked by five youths who punched him and took his property / 1 arrest / some property recovered,robbery,ellis between 51st & 52nd,7/16/10 8:30 pm,7/16/10 8:37 pm,robbery,2010-07-16 20:30:00,41.802265250000005,-87.62885975
neighbors complained of loud music at a residence / peace restored,disturbance,university between 56th & 57th,7/17/10 3:56 am,7/17/10 3:58 am,,2010-07-17 03:56:00,41.7897352,-87.6015376
unknown person took purse that was placed behind a chair that complainant occupied,theft,cornell between 50th & 51st,7/17/10 11:00 am to 11:30 am,7/17/10 12:54 pm,theft,2010-07-17 11:15:00,41.7892116,-87.60406619999999
unknown person took coin purse containing credit card from an unattended handbag left at workstation,theft,970 e. 58th st. (bookstore),7/17/10 1:00 pm,7/17/10 2:30 pm,theft,2010-07-17 13:00:00,41.7895621,-87.601259
$400 taken from unattended purse left in patient's room,theft,5815 s. maryland (mitchell hospital),7/16/10 to 7/17/10 7:00 pm to 3:00 pm,7/17/10 4:23 pm,theft,,41.7932672,-87.5956874
unknown person took an apple macbook laptop computer from a room,theft,1118 e. 58th st. (eckhart hall),7/16/10 to 7/17/10 7:30 pm to 9:30 pm,7/18/10 6:55 am,theft,,41.78962,-87.58657500000001
unknown person smashed driver's side window of car parked on the street and took a sony digital camera and an i-pod from the glove box,theft,56th between woodlawn and kimbark,7/18/10 12:30 am to 10:30 am,7/18/10 11:01 am,theft,,41.7892116,-87.60406619999999
ucpd arrested a man for trespassing to the vacant and boarded former doctors hospital building,criminal trespass to land,5800 s. stony island (doctors hospital),7/18/10 12:42 pm,7/18/10 12:42 pm,,2010-07-18 12:42:00,41.8068755,-87.59922015
patient's cell phone missing after she transferred rooms,lost property,5815 s. maryland (mitchell hospital),7/18/10 2:00 pm to 7:00 pm,7/18/10 7:19 pm,lost,2010-07-18 16:30:00,41.7883128,-87.6045656
"unknown person(s) entered a residence via a rear window taking a lap top computer, marble chess set, and jewelry",burglary,greenwood between 48th & 49th,7/18/10 12:00 pm to 1:00 pm,7/19/10 11:51 am,burglary,2010-07-18 12:30:00,41.79150975,-87.58863249999999
report of receipt of annoying email messages,cyberstalking,5841 s. maryland (mitchell hospital),7/16/10 to 7/18/10 8:50 pm to 10:15 pm,7/19/10 12:30 pm,,,41.7965613,-87.5903774
a sony playstation and an x-box were taken from an apartment during the course of a party,theft,57th between harper & lake park,7/18/10 to 7/19/10 12:30 am to 9:30 am,7/19/10 3:54 pm,theft,,41.789113,-87.600152
"ucpd officer recovered stolen, unattended vehicle parked on the street / turned over to cpd",recovered motor vehicle,blackstone at 54th pl.,7/19/10 11:11 pm,7/19/10 11:11 pm,,2010-07-19 23:11:00,41.789113,-87.600152
"unknown male entered coffee shop, ate two dinners and left without paying",theft,1025 e. 58th st. (swift hall),7/20/10 11:30 am,7/20/10 12:07 pm,theft,2010-07-20 11:30:00,41.7929725,-87.59992779999999
power outage reported / power restored at 1:40 pm,irregular condition,1025 e. 58th st. (swift hall),7/20/10 12:17 pm,7/20/10 12:17 pm,,2010-07-20 12:17:00,41.7935818,-87.5989697
bicycle chained to metal fence taken by unknown person,theft,1101 e. 56th st. (max palevsky central),7/12/10 to 7/20/10  8:00 am to 3:00 pm,7/20/10 3:12 pm,theft,,41.7912712,-87.59819279999999
unknown person(s) forced open three gym locker doors and took three cell phones,theft,5550 s. university (crown field house),7/20/10 3:30 pm to  4:20 pm,7/20/10 4:20 pm,theft,2010-07-20 15:55:00,41.7895621,-87.601259
unknown male placed his hand on woman's buttocks as they passed in a hallway / suspect fled,battery,5706 s. university (reynolds club),7/20/10 4:45 pm,7/20/10 5:07 pm,battery,2010-07-20 16:45:00,41.7901748,-87.59914119999999
woman felt threatened after a verbal exchange with a man dissatisfied with service,assault,1118 e. 58th st. (eckhart hall),7/20/10 2:20 pm,7/20/10 5:34 pm,assault,2010-07-20 14:20:00,41.7942597,-87.5966228
small fire in trash container in the quad extinguished by cfd / no damage,fire / smoke report,1100 e. 58th st. (quad),7/20/10 8:15 pm,7/20/10 8:16 pm,,2010-07-20 20:15:00,41.7892434,-87.5944682
ucpd officer arrested male subject in possession of a stolen motorcycle,recovered motor vehicle,woodlawn between 55th & 56th,7/21/10 12:04 am,7/21/10 12:04 am,,2010-07-21 00:04:00,41.79517815,-87.60256249999999
deliveryman fell down stairs injuring his lower back and head / transported to er by cfd ems,injured person,5815 s. kimbark (belfield hall),7/21/10 3:23 am,7/21/10 3:23 am,,2010-07-21 03:23:00,41.7845959,-87.6008803
unknown person shattered rear window of a car parked on the street,criminal damage to property,55th between drexel and ellis,7/20/10 to 7/21/10 7:00 pm to 3:00 pm,7/21/10 2:57 pm,,,41.7845959,-87.6008803
window damaged / cause undetermined,damage to property,6031 s. ellis (south campus residence hall),7/1910 to 7/21/10 8:00 pm to 2:00 pm,7/21/10 2:13 pm,,,41.79122659999999,-87.5870399
alarm malfunction / cfd responded,fire alarm,6031 s. ellis (south campus residence hall),7/21/10 6:12 pm,7/21/10 6:12 pm,,2010-07-21 18:12:00,41.7879118,-87.6008291
smoke from over-cooked food triggered alarm / no fire / cfd responded,fire alarm,5700 s. stony island,7/21/10 9:43 pm,7/21/10 9:43 pm,,2010-07-21 21:43:00,41.7889661,-87.60093189999999
alarm accidently triggered by contractor servicing system / cfd responded,fire alarm,1010 e. 59th st. (classics),7/22/10 10:31 am,7/22/10 10:31 am,,2010-07-22 10:31:00,41.7932223,-87.59894419999999
ucpd officers arrested male subject for trespass and possession of burglary tools,criminal trespass to land,5811 s. ellis (cobb hall),7/22/10 1:15 pm,7/22/10 1:15 pm,,2010-07-22 13:15:00,41.7912375,-87.59812319999999
unknown person broke window of van parked on the street and took bicycle and gps device,theft from motor vehicle,56th between greenwood & university,7/22/10 3:30 pm,7/22/10 3:39 pm,theft,2010-07-22 15:30:00,41.791942,-87.602839
unknown person took wallet from unattended book bag / unauthorized use of credit card reported,theft,1137 e. 57th st. (hutchinson commons),7/22/10 2:00 pm,7/22/10 4:14 pm,theft,2010-07-22 14:00:00,41.79633335,-87.59683559999999
unknown person took a bicycle that was chained to a bike rack,theft,924 e. 57th st. (bslc),7/22/10 9:00 am to 9:00 pm,7/22/10 9:12 pm,theft,,41.7841049,-87.59952109999999
"four males grabbed man walking on the street, struck him and took his i-pod before fleeing on foot",robbery,woodlawn between 54th & 55th,7/22/10 9:25 pm,7/22/10 9:28 pm,robbery,2010-07-22 21:25:00,41.7883128,-87.6045656
investigation of possible unlawful discharge of a firearm on the street by an unknown person,unlawful use of a weapon,61st at greenwood,7/19/10 7:00 pm to 8:30 pm,7/21/10 2:01 pm,,2010-07-19 19:45:00,41.85529765,-87.65636745
report of receipt of annoying email,cyberstalking,5841 s. maryland (mitchell hospital),7/16/10 9:33 pm,7/23/10 8:37 am,,2010-07-16 21:33:00,41.78138385,-87.59932635
man took cell phone from a youth on the street and refused to return it / ucpd officer located and arrested suspect / phone recovered,theft,blackstone between 50th & 51st st.,7/23/10 12:45 pm,7/23/10 1:01 pm,theft,2010-07-23 12:45:00,41.791942,-87.602839
two males seen entering residence via window / arrest,burglary,greenwood between 62nd & 63rd,7/23/10 1:15 pm,7/23/10 1:25 pm,burglary,2010-07-23 13:15:00,41.7903948,-87.6038772
unknown male caller used ruse in an attempt to secure credit card information from complainant,deceptive practice,924 e. 57th st (bslc),7/21/10 1:00 pm,7/23/10 2:46 pm,,2010-07-21 13:00:00,41.7919788,-87.5983645
unknown person took a bicycle that was secured to a bike rack,theft,5730 s. drexel (comer hospital),7/23/10 4:30 pm to 7:30 pm,7/23/10 7:59 pm,theft,2010-07-23 18:00:00,41.792279,-87.599954
ucpd officer discovered an unlocked exterior door / premise toured and secured,irregular conditions,5640 s. university (bartlett commons),7/23/10 10:26 pm,7/23/10 10:26 pm,,2010-07-23 22:26:00,41.7884006,-87.59909929999999
leak in basement due to heavy rain / engineer notified,irregular conditions,1100 e. 57th st. (regenstein library),7/23/10 11:57 pm,7/23/10 11:57 pm,,2010-07-23 23:57:00,41.78952109999999,-87.60424909999999
clogged drain on roof caused water leak that triggered alarm / cfd responded,fire alarm,5835 s. greenwood (stuart hall),7/24/10 7:27 am,7/24/10 7:27 am,,2010-07-24 07:27:00,41.78960720000001,-87.5964144
report of water leaks and flooding of several campus buildings due to heavy rains,irregular conditions,various campus buildings,7/24/10  12:00:00 am to 10:00 am,7/24/10 10:45 am,,,41.7892116,-87.60406619999999
power surge reported at mitchell er and several buildings on campus,irregular conditions,901 e. 58th st. (mitchell er),7/24/10 9:35 am,7/24/10 11:33 am,,2010-07-24 09:35:00,41.790225,-87.60255599999999
unknown person took unsecured bicycle from lobby of apartment building,theft,greenwood at 53rd,7/24/10 1:00 am to 6:00 am,7/24/10 1:38 pm,theft,2010-07-24 03:30:00,41.7846534,-87.60485700000001
unknown person scrawled graffiti on two bulletin boards and a table in the quad area / facilities notified,criminal damage to property,1125 e. 58th st.,7/20/10 to 7/24/10 3:00 pm to 2:55 pm,7/24/10 2:56 pm,,,41.8021795,-87.5928239
patient reports a hp computer missing after she transferred rooms in the hospital,lost property,5815 s. maryland (mitchell hospital),7/24/10 11:00 am to 7:05 pm,7/24/10 7:07 pm,lost,,41.7903948,-87.6038772
doors to library were propped open with newspaper / ucpd conducted premise check,irregular conditions,5730 s. ellis (crerar library),7/23/10 to 7/24/10 10:00 pm to 8:00 am,7/24/10 9:44 pm,,,41.7927938,-87.59843049999999
power outage reported / comed restored power at 11:25 pm,irregular conditions,6054 s. drexel (ucpd) / 6031 s. ellis (south campus res. hall),7/24/10 9:45 pm,7/24/10 9:45 pm,,2010-07-24 21:45:00,41.78796639999999,-87.59953639999999
person freed from stuck elevator by cfd,irregular conditions,1359 e. hyde park (fairfax),7/24/10 9:54 pm,7/24/10 9:54 pm,,2010-07-24 21:54:00,41.79633335,-87.59683559999999
unknown person took credit cards and id from an unattended wallet in comer er waiting area,theft,5730 s. drexel (comer er),7/24/10 to 7/25/10 11:30 pm to 12:55 am,7/25/10 12:55 am,theft,,41.7927938,-87.59843049999999
sick person transported to provident hospital by cfd ems,sick person,5630 s. university (max palevsky east),7/25/10 1:03 am,7/25/10 1:03 am,,2010-07-25 01:03:00,41.7845959,-87.6008803
ucpd officer found briefcase on bench / owner contacted,found property,1116 e. 59th st. (harper library),7/25/10 7:47 am,7/25/10 7:47 am,,2010-07-25 07:47:00,41.79433474999999,-87.5823006
complainant scammed via email / gave cnet id and password to unknown party,deceptive practice,woodlawn between 54th & 55th,7/22/10 10:00 pm,7/25/10 8:08 am,,2010-07-22 22:00:00,41.7892116,-87.60406619999999
subject arrested for possession of marijuana,possession of cannabis,5630 s. university (max palevsky east),7/25/10 10:12 am,7/25/10 10:12 am,,2010-07-25 10:12:00,41.7892116,-87.60406619999999
alarm malfunction / cfd responded,fire alarm,6031 s. ellis (south campus residence hall),7/25/10 11:23 am,7/25/10 11:23 am,,2010-07-25 11:23:00,41.795178,-87.5947959
ucpd officers came to aid of woman calling for help / no crime committed,miscellaneous,everett between 55th & 56th,7/25/10 1:19 pm,7/25/10 1:19 pm,,2010-07-25 13:19:00,41.7842593,-87.608048
patient reports loss of eye glasses,lost property,5815 s. maryland (mitchell hospital),7/23/10 12:00 pm to 6:00 pm,7/25/10 1:41pm,lost,,41.7884006,-87.59909929999999
unattended wallet taken from table in café,theft,5815 s. maryland (mitchell hospital),7/25/10 12:00 pm to 1:00 pm,7/25/10 2:11 pm,theft,2010-07-25 12:30:00,41.788274,-87.598276
male exiting cta bus grabbed cell phone from a passenger's hand and fled,theft from person,55th at kimbark,7/25/10 4:44 pm,7/25/10 4:45 pm,theft,2010-07-25 16:44:00,41.791942,-87.602839
power outage caused by shorted switch / power restored at 11:50 pm,irregular conditions,61st to 65th / cottage grove to university,7/25/10 11:25 pm,7/25/10 11:25 pm,,2010-07-25 23:25:00,41.78552,-87.6018945
condensation in line triggered fire alarm / cfd responded,fire alarm,5835 s. greenwood (stuart hall),7/26/10 8:28 am,7/26/10 8:30 am,,2010-07-26 08:28:00,41.7893783,-87.6025521
report of on-going harassing telephone calls from a known individual / investigation being conducted by cpd,harassment by telephone,5848 s. university (kelly hall),1/29/10 to7/22/10 periodic,7/26/10 9:05 am,,,41.78952109999999,-87.60424909999999
staff member reports losing her office keys,lost property,924 e. 57th st. (bslc),7/26/10 1:00 pm to 2:30 pm,7/26/10 4:31 pm,lost,2010-07-26 13:45:00,41.792279,-87.599954
unknown person cut u lock and took bicycle from bike rack,theft,969 e. 60th st. (ssa),7/26/10 to 7/27/10 5:00 pm to 8:00 am,7/27/10 12:10 pm,theft,,41.7912117,-87.59993519999999
unattended macbook laptop computer taken from unlocked room,theft,947 e. 58th st. (abbott memorial hall),7/27/10 11:00 am to 12:30 pm,7/27/10 3:02 pm,theft,2010-07-27 11:45:00,41.79954035,-87.59588355
disagreement between two staff members,information,901 e. 58th st. (ucmc er),7/27/10 7:20 pm,7/27/10 7:28 pm,,2010-07-27 19:20:00,41.7952081,-87.5839381
unknown person took secured bicycle from bike rack,theft,1100 e. 57th st. (regenstein library),7/27/10 12:20 pm to 6:50 pm,7/27/10 8:35 pm,theft,,41.78552,-87.6018945
unknown person took bicycle secured to bike rack,theft,1027 e. 57th st. (anatomy),7/27/10 4:00 pm to 11:30 pm,7/27/10 11:44 pm,theft,,41.7900088,-87.60020999999999
unknown person shattered glass entrance door of restaurant with an unknown object,criminal damage to property,53rd between woodlawn & kimbark,7/28/10 12:30 am to 6:00 am,7/28/10 7:48 am,,2010-07-28 03:15:00,41.7892116,-87.60406619999999
unknown man followed woman and chased her into the lobby of her apartment building / no physical contact / no words exchanged,assault,hyde park blvd. at 55th,7/26/10 9:50 pm,7/28/10 9:17 am,assault,2010-07-26 21:50:00,41.78962,-87.58657500000001
unknown person took secured bicycle from bike rack,theft,969 e. 60th st. (ssa),7/27/10 to 7/28/10 5:00 pm to 8:00 am,7/28/10 9:43 am,theft,,41.7886079,-87.5987133
secured bicycle taken from bike rack,theft,1020 e. 58th st. (kent lab),7/28/10 9:20 am to 12:05 pm,7/28/10 12:15 pm,theft,2010-07-28 10:42:30,41.7891387,-87.5954555
wallet taken from woman's purse / possibly in hallway or elevator,theft,5815 s. maryland (mitchell hospital),7/28/10 2:15 pm,7/28/10 2:43 pm,theft,2010-07-28 14:15:00,41.8027214,-87.5923116
ucpd officer discovered an open door in the vacant building / officers toured premises / no persons found,open door,5800 s. stony island (doctor's hospital),7/28/10 9:14 pm,7/28/10 9:14 pm,,2010-07-28 21:14:00,41.7889722,-87.59926279999999
unknown person took a bicycle that was secured to a metal post in front of a residential building,theft,university between 55th & 56th,7/28/10 7:10 pm to 10:25 pm,7/28/10 10:29 pm,theft,2010-07-28 20:47:30,41.7877085,-87.6036874
apparent alarm malfunction / no smoke or fire / cfd responded,fire alarm,5807 s. woodlawn (booth school),7/29/10 4:33 am,7/29/10 4:33 am,,2010-07-29 04:33:00,41.8140223,-87.6086873
city garbage container and wooden fence damaged by fire,arson,madison park between kenwood and dorchester,7/28/10 to 7/29/10 6:00 pm to 7:00 am,7/29/10 7:46 am,,,41.8041012,-87.6042494
unknown person took bicycle that had been secured to bike rack,theft,1101 e. 58th st. (rosenwald hall),7/28/10 8:00 am to 5:30 pm,7/29/10 8:52 am,theft,,41.7948341,-87.6003897
woman felt threatened after receiving an anonymous phone call,telephone threat,860 e. 59th st. (goldblatt pavilion),7/28/10 1:00 pm,7/29/10 9:30 am,,2010-07-28 13:00:00,41.7955712,-87.60568579999999
power outage reported / restore at 11:10 am,irregular conditions,4444 s. evans (woodson charter school),7/29/10 9:45 am to 11:10 am,7/29/10 10:56 am,,2010-07-29 10:27:30,41.7911305,-87.6027488
woman walking on the street felt threatened by the actions of a stranger / suspect gone upon arrival of police,assault,drexel at 50th,7/29/10 11:53 am,7/29/10 11:53 am,assault,2010-07-29 11:53:00,41.7905318,-87.5948216
unknown person smashed window of van parked on the street / took gps device and two motorola portable radios,theft from motor vehicle,cottage grove at 59th,7/29/10 11:00 am,7/29/10 1:23 pm,theft,2010-07-29 11:00:00,41.7899689,-87.6052594
unknown person smashed window of car parked on the street / took gps device,theft from motor vehicle,ellis at 55th,7/29/10 8:45 am to 3:00 pm,7/29/10 3:19 pm,theft,,41.79356019999999,-87.5804228
disgruntled man threw a door open causing a hole in the wall,criminal damage to property,800 e. 55th st (friend center),7/29/10 3:20 pm,7/29/10 4:32 pm,,2010-07-29 15:20:00,41.79237515,-87.59324325
unknown person took bicycle that had been secured to bike rack,theft,929 e. 57th st. (gordon center),7/29/10 9:20 am to 4:15 pm,7/29/10 4:33 pm,theft,,41.7951617,-87.58947334999999
unknown person took bicycle that had been secured to a lamp post in the courtyard of residential building,theft,kimbark between 57th & 58th,7/28/10 to 7/29/10 8:00 am to 5:00 pm,7/29/10 5:36 pm,theft,,41.788936,-87.59915289999999
woman lost her wallet while in the cafeteria,lost property,5758 s. maryland (dcam),7/29/10 1:30 pm to 4:00 pm,7/29/10 5:54 pm,lost,2010-07-29 14:45:00,41.7891768,-87.60195080000001
unknown female was seen entering an unlocked car parked on the street taking $5.00 in quarters,theft from motor vehicle,shore dr. at 56th,7/29/10 6:50 pm,7/29/10 7:14 pm,theft,2010-07-29 18:50:00,41.7880092,-87.5987709
ucpd checked well-being of an individual at the request of a friend / all was well,well-being check,kenwood between 56th & 57th,7/30/10 3:15 am,7/30/10 3:50 am,,2010-07-30 03:15:00,41.79150975,-87.58863249999999
unknown male customer grabbed money from cash register as salesperson was making change / suspect fled on foot,theft,55th between cornell and hyde park,7/30/10 12:10 pm,7/30/10 12:13 pm,theft,2010-07-30 12:10:00,41.800879550000005,-87.59899435
two bicycles chained together were taken from bike rack,theft,1115 e. 58th st. (walker),7/30/10 2:00 pm to 3:00 pm,7/30/10 3:05 pm,theft,2010-07-30 14:30:00,41.7927938,-87.59843049999999
unknown person took secured bicycle from bike rack,theft,5812 s. ellis (brain research),7/30/10 9:00 am to 3:45 pm,7/30/10 4:05 pm,theft,,41.800082950000004,-87.60426819999999
unknown person used a tool to cut bar on bike rack and took a secured bicycle,theft,1126 e. 59th st. (social science),7/30/10 3:30 pm to 5:30 pm,7/30/10 8:46 pm,theft,2010-07-30 16:30:00,41.7940762,-87.60170769999999
"unknown person(s) gained entry to residential apartment by undetermined method taking an acer laptop computer, jewelry box and jewelry",burglary,57th between harper & lake park,7/30/10 to 7/31/10 10:30 pm to 2:00 am,7/31/10 2:11 am,burglary,,41.7891387,-87.5954555
"entry gained to residential apartment via front window / 3 computers, $175 in coins, medical equipment taken by unknown person(s)",burglary,52nd between greenwood & university,7/30/10 to 7/31/10 8:30 pm to 1:45 am,7/31/10 2:20 am,burglary,,41.7857447,-87.5902973
unknown person scrawled graffiti on exterior wall / facilities notified,criminal damage to property,5730 s. ellis (crerar library),7/30/10 to 7/31/10 6:00 pm to 3:30 pm,7/31/10 3:32 pm,,,41.784608250000005,-87.60110764999999
unknown person scrawled graffiti on exterior wall / facilities notified,criminal damage to property,5630 s. university (max palevsky east),7/30/10 to 7/31/10 11:00 pm to 8:00 am,7/31/10 5:20 pm,,,41.784061449999996,-87.60519635
unknown person smashed window of car parked on the street / took gps device,theft from motor vehicle,drexel between 52nd & 53rd,7/31/10 to 8/1/10 9:00 pm to 9: 15 am,8/1/10 9:22 am,theft,,41.8008025,-87.5909195
alarm malfunction / cfd responded,fire alarm,5530 s. ellis (ratner ac),8/1/10 10:42 am,8/1/10 10:42 am,,2010-08-01 10:42:00,41.7899618,-87.6863375
alarm malfunction / cfd responded,fire alarm,5807 s. woodlawn (booth school),8/1/10 11:00 pm,8/1/10 11:00 pm,,2010-08-01 23:00:00,41.792279,-87.599954
unknown person broke office window /  dell laptop computer and docking station taken from desk top,burglary,1427 e. 60th st. (press office),7/29/10 to 8/2/10 6:00 pm to 8:45 am,8/2/10 9:24 am,burglary,,41.7795601,-87.60591925
cpd arrested a man wanted on a warrant and found him in possession of a stolen bicycle / bike turned over to ucpd being held for owner,theft,ellis between 60th & 61st,8/1/10 unknown,8/2/10 12:03 pm,theft,,41.7892116,-87.60406619999999
unknown person smashed window of vehicle parked in vacant lot and took a gps device,theft from motor vehicle,61st between cottage grove & drexel,8/2/10 7:45 am to 1:15 pm,8/2/10 1:27 pm,theft,2010-08-02 10:30:00,41.80422185,-87.5953691
unknown person smashed window of car in parking lot and took a gps device,theft from motor vehicle,blackstone at 51st,8/1/10 to 8/2/10 4:00 pm to 12:30 pm,8/2/10 1:55 pm,theft,,41.7857447,-87.5902973
bag containing electronic equipment found on the street and turned over to ucpd / property being held by cpd,found property,harper between 58th & 59th,8/2/10 1:56 pm,8/2/10 1:56 pm,,2010-08-02 13:56:00,41.7961891,-87.58853669999999
ucpd officers observed two males attempting to take bicycle from bike rack / had stolen property in their possession / arrest by ucpd,theft of lost or mislaid property,1100 e. 57th st. (regenstein library),8/2/10 5:30 pm,8/2/10 5:46 pm,theft,2010-08-02 17:30:00,41.7883128,-87.6045656
male subject punched female in the course of an argument on the street / arrest by ucpd,domestic battery,cottage grove between 63rd & 64th,8/2/10 6:40 pm,8/2/10 7:03 pm,battery,2010-08-02 18:40:00,41.788829,-87.59125449999999
"2 rings, necklace, and $10 cash taken from purse in patient's room",theft,5815 s. maryland (mitchell hospital),7/29/10 to 8/2/10 2:00 pm to 1:00 pm,8/3/10 10:58 am,theft,,41.78962,-87.58657500000001
complainant reported a series of harassing email messages and phone calls from a former girlfriend,harassment by electronic means,50th between cornell & shore dr.,8/3/10 12:45 am,8/3/10 4:01 pm,,2010-08-03 00:45:00,41.7855444,-87.60313149999999
unknown person took secured bicycle from bike rack,theft,1427 e. 60th st. (press building),8/3/10 1:30 pm to 5:00 pm,8/3/10 5:04 pm,theft,2010-08-03 15:15:00,41.7920173,-87.60110019999999
suspicious suitcase found outside door of a store / cpd bomb and arson notified / suitcase contained garbage,suspicious package,1526 e. 55th st. (hyde park shopping ctr.),8/3/10 10:59 pm,8/3/10 10:59 pm,,2010-08-03 22:59:00,41.7987785,-87.59487139999999
"unknown person took an unattended fanny pack from patient's room / contained a wallet, cell phone, check book / unauthorized use of a credit card subsequently reported",theft,5841 s. maryland (ucmc),8/4/10 2:00 pm to 2:05 pm,8/4/10 2:36 pm,theft,2010-08-04 14:02:30,41.7911305,-87.6027488
unknown person damaged bottom panel of overhead garage door,criminal damage to property,5825 s. dorchester (stein place),8/4/10 5:00 pm to 5:50 pm,8/4/10 6:39 pm,,2010-08-04 17:25:00,41.792984,-87.6024664
radiation sensor lost while working at the site,lost property,5800 s. stony island (doctors hospital),7/18/10 12:40 pm,8/4/10 6:45 pm,lost,2010-07-18 12:40:00,41.7915946,-87.6022845
unknown person pushed on window grate causing damage to a file cabinet that tipped over,criminal damage to property,6016 s. ingleside (midway studios),8/4/10 to 8/5/10 5:00  pm to 8:30 am,8/5/10 12:29 pm,,,41.7912712,-87.59819279999999
two construction workers involved in heated argument / worker escorted from site by ucpd / peace restored,miscellaneous,5659 s. ellis (construction site),8/3/10 10:00 am,8/6/10 5:35 am,,2010-08-03 10:00:00,41.807813949999996,-87.5959971
unknown person smashed window of car parked on the street / took gps device and sunglasses,theft from motor vehicle,kimbark between 53rd & 54th,8/5/10 to 8/6/10 10:00 pm to 8:30 am,8/6/10 8:32 am,theft,,41.7879593,-87.5995794
unknown person took hp laptop computer from patient's room,theft,5815 s. maryland (mitchell hospital),7/31/10 3:00 am to 2:00 pm,8/6/10 11:56 am,theft,,41.79219705,-87.5990492
chemical splashed in man's eyes during the course of an experiment / transported to hospital by cfd ems,injured person,929 e. 57th st. (gordon center),8/6/10 1:10 pm,8/6/10 1:14 pm,,2010-08-06 13:10:00,41.7932672,-87.5956874
unknown person took unattended mac laptop computer from unlocked office,theft,935 e. 56th st. (high energy physics bldg.),8/6/10 2:00 pm to 2:19 pm,8/6/10 2:19 pm,theft,2010-08-06 14:09:30,41.7905318,-87.5948216
unknown person took wireless device from office,theft,940 e. 57th st. (bio-psych. bldg.),8/2/10 4:00 pm,8/6/10 4:27 pm,theft,2010-08-02 16:00:00,41.791483,-87.5916036
officer found unlocked door during a premise check / engineer notified,irregular conditions,5706 s. university (reynolds club),8/6/10 10:53 pm,8/6/10 10:53 pm,,2010-08-06 22:53:00,41.7940762,-87.60170769999999
unknown person slashed three tires on a car parked on the street,criminal damage to vehicle,48th between woodlawn & kimbark,8/6/10 to 8/7/10 7:30 pm to 6:30 am,8/7/10 8:01 am,,,41.80093665,-87.59424719999998
unknown person smashed window of car parked on the street and took a gps device,theft from motor vehicle,university at 59th,8/5/10 to 8/7/10 11:00 pm to 12:40 pm,8/7/10 12:45 pm,theft,,41.7877085,-87.6036874
unknown person removed lock from the rear door of a workman's van parked on the street and took construction tools,theft from motor vehicle,60th between greenwood & university,8/7/10 1:40 pm to 2:00 pm,8/7/10 2:12 pm,theft,2010-08-07 13:50:00,41.7846534,-87.60485700000001
residents complained about a loud party in a residence / peace restored,disturbance,56th between woodlawn & kimbark,8/8/10 1:41 am,8/8/10 1:41 am,,2010-08-08 01:41:00,41.7846543,-87.6015671
residents complained of loud noise coming from a group of people in a limo parked on the street / peace restored,disturbance,kimbark between 57th & 58th,8/8/10 5:09 am,8/8/10 5:09 am,,2010-08-08 05:09:00,41.789455,-87.60623900000002
unknown person smashed window of car parked on the street and took gps device,theft from motor vehicle,dorchester at 57th,8/8/10 7:15 pm to 8:45 pm,8/8/10 8:58 pm,theft,2010-08-08 20:00:00,41.7846534,-87.60485700000001
man left student id card unattended while exercising / unknown person took id card,theft,5530 s. ellis (ratner ac),8/6/10 6:00 pm to 6:30 pm,8/9/10 10:13 am,theft,2010-08-06 18:15:00,41.7806111,-87.58645059999999
unknown person attempted to scam money from complainant via email,deceptive practice,52nd between kimbark  & kenwood,8/7/10 6:30 am,8/9/10 11:25 am,,2010-08-07 06:30:00,41.782383,-87.606062
verbal altercation between two staff members / peace restored,disturbance,860 e. 59th st. (goldblatt pavilion),8/9/10 7:30 am,8/9/10 12:22 pm,,2010-08-09 07:30:00,41.805081650000005,-87.59675920000001
damage found on university owned vehicle parked in parking structure,damage to property,6054 s. drexel (ucpd),8/9/10 7:00 am,8/9/10 6:30 pm,,2010-08-09 07:00:00,41.7897352,-87.6015376
ucpd officer arrested male subject in the process of cutting copper wire attached to gate box,attempt theft,6058 s. ellis (edelstone parking lot),8/9/10 7:38 pm,8/9/10 7:38 pm,theft,2010-08-09 19:38:00,41.7888677,-87.6054776
unknown person smashed rear passenger's side window of car parked on the street and took a gps device,theft,cottage grove at 58th,8/9/10 6:00 am to 8:30 pm,8/9/10 8:45 pm,theft,,41.79055175,-87.59319895000002
handicap door in lobby of building could not be properly secured / facilities notified,irregular conditions,6054 s. drexel (ucpd),8/9/10 11:34 pm,8/9/10 11:34 pm,,2010-08-09 23:34:00,41.7830906,-87.60845705
ucpd officers arrested a male subject wanted on a warrant,warrant arrest,stony island at 63rd,8/10/10 4:30 am,8/10/10 4:30 am,,2010-08-10 04:30:00,41.7886565,-87.5963637
male subject shot in the left leg after an argument with another male subject on the street / transported to hospital by cfd ems,aggravated battery,cottage grove at 62nd,8/10/10 9:15 am,8/10/10 9:15 am,battery,2010-08-10 09:15:00,41.78748915,-87.6292788
unknown person slashed four tires on a car parked on the street,criminal damage to vehicle,woodlawn between 49th & 50th,8/7/10 to 8/8/10 10:00 pm to 5:00 am,8/10/10 10:53 am,,,41.7888677,-87.6054776
"family reported man, suffering from illness, wandered off and could not be located / man later found and escorted home by ucpd",missing person,970 e. 58th st. (bookstore),8/10/10 10:00 am,8/10/10 11:13 am,,2010-08-10 10:00:00,41.7883236,-87.579563
unknown person took dvd disk from office,theft,5841 s. cottage grove (general stores),8/10/10 7:00 am to 7:45 am,8/10/10 11:46 am,theft,2010-08-10 07:22:30,41.7892116,-87.60406619999999
unknown person smashed the driver's side window of a car parked on the street and took a gps device,theft from motor vehicle,kenwood between 57th & 58th,8/9/10 to 8/10/10 8:00 pm to 11:45 am,8/10/10 12:26 pm,theft,,41.7889722,-87.59926279999999
ucpd officers chased an unknown suspect who abandoned a canon digital camera and an olympus voice recorder while fleeing,found property,langley between 61st & 62nd,8/10/10 3:25 pm,8/10/10 4:19 pm,,2010-08-10 15:25:00,41.7949304,-87.599116
unknown person smashed passenger's side window of car parked on the street and took a gym bag,theft from motor vehicle,woodlawn between 58th & 59th,8/10/10 7:25 am to 4:30 pm,8/10/10 5:08 pm,theft,,41.7892116,-87.60406619999999
ucpd officer arrested man for possession of a stolen bicycle / owner of bike not known at the time,possession of lost or stolen property,harper between 54th & 55th,8/10/10 11:35 pm,8/10/10 11:38 pm,lost,2010-08-10 23:35:00,41.7897352,-87.6015376
deliveryman fell from loading dock and fractured his left ankle / transported to er by cfd ems,injured person,5841 s. cottage grove (materials mgt.),8/11/10 5:00 am,8/11/10 5:29 am,,2010-08-11 05:00:00,41.7892116,-87.60406619999999
unknown person smashed window of vehicle parked on the street and took a gps device,theft from motor vehicle,59th & payne dr.,8/10/10 8:00 am to 5:30 pm,8/11/10 12:12 pm,theft,,41.7955712,-87.60568579999999
woman injured her finger when it became caught in the metal support of a chair / treated at er,injured person,5815 s. maryland (mitchell hosp.),8/11/10 1:10 pm,8/11/10 1:18 pm,,2010-08-11 13:10:00,41.7879061,-87.60146689999999
unknown person removed a macbook pro computer from under a podium in an unsecured lecture hall,theft,1101 e. 58th st. (rosenwald),7/30/10 to 8/3/10 5:00 pm to 10:00 am,8/11/10 2:10 pm,theft,,41.82161339999999,-87.6005934
a male and two females involved in  an argument that resulted in physical contact by all involved / all three refused to sign complaints / peace restored,battery,57th between greenwood & university,8/11/10 2:15 pm,8/11/10 2:24 pm,battery,2010-08-11 14:15:00,41.7901847,-87.60458489999999
woman said she tripped over a chair in the er and fell on her back / delayed report,injured person,5815 s. maryland (mitchell er),8/6/10 unknown,8/11/10 2:15 pm,,,41.7919788,-87.5983645
employee reports a co-worker verbally threatened her causing her to fear for her safety,assault,970 e. 58th st. (bookstore),8/11/10 5:20 pm,8/11/10 6:39 pm,assault,2010-08-11 17:20:00,41.7964645,-87.60130104999999
patient left the hospital without being properly released,miscellaneous,5815 s. maryland (mitchell hosp.),8/12/10 9:30 am,8/12/10 10:40 am,,2010-08-12 09:30:00,41.7949533,-87.58937854999999
unknown person took an unattended cell phone from an examination room,theft,800 e. 55th st. (friend center),8/12/10 12:00 pm to 1:10 pm,8/12/10 1:41 pm,theft,2010-08-12 12:35:00,41.7880702,-87.5956216
leica light microscope taken from secured room,theft,970 e. 59th st. (mclean inst.),4/1/10 to 8/4/10 8:00 am to 5:00 pm,8/12/10 2:05 pm,theft,,41.7801644,-87.61150250000001
resident reports she saw 10-15 unknown male & female teens run from her home while she was in rear yard / $300 and two bottles of wine taken / no sign of forced entry,burglary,oakenwald between 40th & 41st,8/12/10 6:15 pm,8/12/10 6:17 pm,burglary,2010-08-12 18:15:00,41.7896587,-87.5915533
woman visiting child reported child's father violated order of protection by visiting while she was present,violation of order of protection,5721 s. maryland (comer hospital),8/12/10 7:45 pm,8/12/10 8:33 pm,,2010-08-12 19:45:00,41.7858335,-87.6058611
ucpd unit found exterior door of building unlocked / checked premise / all secure,irregular conditions,5640 s. university (bartlett commons),8/13/10 1:23 am,8/13/2010 1:23,,2010-08-13 01:23:00,41.7916996,-87.68692994999999
"resident awaked to find an unknown man standing in the kitchen / when observed, suspect fled out rear door / entry made via open window",burglary,ellis between 54th & 55th,8/13/10 4:20 am,8/13/10 4:21 am,burglary,2010-08-13 04:20:00,41.7851673,-87.59858659999999
anonymous person placed a call that a man was displaying a handgun in a hospital office / no person found / anonymous caller not found,disturbance,5841 s. maryland (mitchell hospital),8/13/10 7:32 am,8/13/10 7:32 am,,2010-08-13 07:32:00,41.7929725,-87.59992779999999
"unknown person(s) gained entry to residence via broken window / took tv, computers, cell phone, wallet, keys / honda odyssey taken from street",burglary,55th pl. between blackstone & harper,8/12/10 to 8/13/10 11:00 pm to 7:30 am,8/13/10 8:13 am,burglary,,41.7934028,-87.60085939999999
unknown person took secured bicycle from bike rack,theft,1212 e. 59th st. (ida noyes),8/10/10 to 8/13/10 12:00 pm to 12:00 pm,8/13/10 2:22 pm,theft,,41.7886079,-87.5987133
male subject attempted to pick complainant's pocket while on the sidewalk,attempt theft,out of area 541 e. 63rd st.,8/13/10 10:30 pm,8/13/10 11:40 pm,theft,2010-08-13 22:30:00,41.80100059999999,-87.5891152
unknown male grabbed a man walking on the sidewalk tearing his shirt / suspect fled when victim activated his vehicle alarm,battery,dorchester at 58th,8/14/10 9:15 pm,8/14/10 9:33 pm,battery,2010-08-14 21:15:00,41.78963385,-87.5939875
man on the street shot and killed by another man / suspect detained by cpd detectives,homicide,out of area - 60th & cottage grove,8/15/10 12:01 am,8/15/10 12:06 am,,2010-08-15 00:01:00,41.79658934999999,-87.5918714
male subject took bicycle from the rear of a building / arrest by ucpd,theft,harper between 57th & 58th,8/15/10 3:27 pm,8/15/10 3:27 pm,theft,2010-08-15 15:27:00,41.78156,-87.60318199999999
staff member found expended bullet near the reflecting pool on the law school grounds / turned over to cpd,found property,1111 e. 60th st. (law school),8/11/2010  unknown,8/16/10 7:48 am,,,41.80090965,-87.59586984999999
graffiti scrawled on fire exit door of the building / facilities notified for removal,criminal damage to property,1101 e. 56th st (max palevsky central),8/16/10 8:49 am,8/16/10 8:49 am,,2010-08-16 08:49:00,41.797963,-87.5966091
driver's side view mirror of university owned van was forcibly removed from the vehicle,criminal damage to vehicle,5555 s. ellis (young parking lot),8/13/10 to 8/16/10 4:30 pm to 6:45 am,8/16/10 9:56 am,,,41.7964645,-87.60130104999999
"woman reports a male subject in a vehicle parked on the street may have been fondling himself, but she was not certain",information,university between 55th & 56th,8/13/10 5:00 pm,8/16/10 2:00 pm,,2010-08-13 17:00:00,41.7899689,-87.6052594
ucpd officers arrested a male subject shortly after he took a bicycle parked on the street / property returned to owner,theft,harper at 52nd,8/16/10 5:40 pm,8/16/10 5:42 pm,theft,2010-08-16 17:40:00,41.7986738,-87.59972594999999
unknown person(s) took copper downspouts from building,theft,58th between kimbark & kenwood,7/5/10 to 8/16/10 12:00 pm to 1:00 pm,8/16/10 5:59 pm,theft,,41.79646285,-87.6019986
unknown person broke rear window to gain entry to residence / took 2 digital cameras and jewelry,burglary,kenwood between 54th & 55th,8/16/10 9:20 am to 5:50 pm,8/16/10 6:55 pm,burglary,,41.78952109999999,-87.60424909999999
ucpd officers found a handgun hidden in a tree planter on the street / turned over to cpd for processing,found property,ingleside at 62nd,8/16/10 9:13 pm,8/16/10 9:13 pm,,2010-08-16 21:13:00,41.79955515,-87.58836055
unknown person gained entry to apartment via an open window / took dell laptop computer & i-pod,burglary,52nd between woodlawn & kimbark,8/16/10 9:30 pm to10:00 pm,8/16/10 10:05 pm,burglary,,41.78223009999999,-87.6051593
resident arrived at home to find an unknown male in his apartment / suspect fled via an open window,burglary,woodlawn at 54th,8/16/10 11:55 pm,8/17/10 12:01 am,burglary,2010-08-16 23:55:00,41.78156,-87.60318199999999
unknown person gained entry to apartment via an unlocked window and took $15 cash,burglary,ellis between 54th & 55th,8/16/10 to 8/17/10 7:00 pm to 8:30 am,8/17/10 9:00 am,burglary,,41.7860899,-87.6806761
unknown person took $640 cash from unattended purse in women's washroom,theft,5758 s. maryland (dcam),8/17/10 1:15 pm to 1:30 pm,8/17/10 4:02 pm,theft,2010-08-17 13:22:30,41.7846534,-87.60485700000001
"bicycle was secured to a light pole / unknown person took frame and rear wheel, leaving front wheel secured to the pole",theft,greenwood between 53rd & 54th,8/16/10 to 8/17/10 4:00 pm to 11:00 am,8/17/10 7:03 pm,theft,,41.7901516,-87.6010282
unknown person pulled air conditioner from window to gain entry to apartment / took jewelry box and jewelry,burglary,54th pl. between ingleside & ellis,8/17/10 8:30 am to 10:45 pm,8/17/10 10:51 pm,burglary,,41.7967877,-87.6050707
patient reports unknown person took $20 from his unattended wallet,theft,901 e. 58th st. (mitchell er),8/18/10 9:00 am to 10:00 am,8/18/10 1:07 pm,theft,2010-08-18 09:30:00,41.78223699999999,-87.60435149999999
unknown person cut cable and took bicycle from bike rack on the street,theft,53rd between hyde park & south shore dr.,8/16/10 to 8/17/10 3:00 pm to 12:00 pm,8/18/10 2:09 pm,theft,,41.8009766,-87.5904687
man walking on the street shot in the leg by one of two unknown suspects / transported to hospital by cfd ems,aggravated battery,62nd between cottage grove & drexel,8/18/10 3:10 pm,8/18/10 3:13 pm,battery,2010-08-18 15:10:00,41.7951617,-87.58947334999999
ucpd officers arrested a man who incited a group and threatened police officers,reckless conduct,ingleside at 62nd,8/18/10 5:25 pm,8/18/10 5:25 pm,,2010-08-18 17:25:00,41.794451,-87.59861540000001
complainant observed male riding a bicycle exposing himself,indecent exposure,59th near blackstone,8/18/10 8:00 pm,8/19/10 8:03 am,,2010-08-18 20:00:00,41.7841369,-87.6061299
person banned from university property telephoned stating his intentions to visit / advised he is subject to arrest if he does so,miscellaneous,6054 s. drexel (ucpd hq),8/19/10 8:35 am,8/19/10 8:35 am,,2010-08-19 08:35:00,41.789113,-87.600152
unknown person took secured bicycle from bike rack,theft,5747 s. ellis (quad),8/18/10 8:30 am to 6:00 pm,8/19/10 9:32 am,theft,,41.77966605,-87.6704015
ucpd officers arrested a man wanted on a warrant,warrant arrest,maryland at 54th,8/19/10 5:38 pm,8/19/10 5:38 pm,,2010-08-19 17:38:00,41.7892116,-87.60406619999999
"two males struck a male in the face, took his cell phone and fled / ucpd officer arrested suspects shortly thereafter",robbery,drexel at 62nd,8/19/10 8:15 pm,8/19/10 8:21 pm,robbery,2010-08-19 20:15:00,41.7901748,-87.59914119999999
unknown male grabbed woman from behind on the sidewalk / suspect fled when woman yelled at him,battery,blackstone at 52nd,8/19/10 8:50 pm,8/19/10 8:59 pm,battery,2010-08-19 20:50:00,41.78802779999999,-87.5939404
"unknown male entered store, implied he had a gun / took $200 from cash register and fled",aggravated robbery,55th between cornell & hyde park,8/19/10 11:15 pm,8/19/10 11:24 pm,robbery,2010-08-19 23:15:00,41.78962,-87.58657500000001
three unknown males climbed fire escape and knocked on doors to gain entry,suspicious activity,5514 s. university (pierce hall),8/20/10 12:05 am,8/20/10 11:35 am,,2010-08-20 00:05:00,41.7864054,-87.5914834
two staff members injured in traffic crash / one treated and released at mitchell er,injured person,cottage grove at 61st,8/20/10 12:48 pm,8/20/10 12:48 pm,,2010-08-20 12:48:00,41.8043425,-87.5864888
man became upset and kicked a pew damaging same / arrest by ucpd,criminal damage to property,1025 e. 58th st. (bond chapel),8/20/10 2:00 pm,8/20/10 2:10 pm,,2010-08-20 14:00:00,41.7994889,-87.5917812
unknown person took a black 1987 olds cutlass parked on the street,theft of motor vehicle,midway pl. between woodlawn & kimbark,8/18/10 12:30 pm to 3:30 pm,8/20/10 4:31 pm,theft,2010-08-18 14:00:00,41.787827,-87.606201
"female patient, who cannot communicate verbally, used another method of communication to indicate she was fondled by an unknown male / investigation continues",criminal sexual abuse,5815 s. maryland (mitchell hospital),8/16/10 to 8/18/10 unknown,8/20/10 5:00 pm,,,41.7852571,-87.6025236
unattended blackberry taken from desk in unsecured office,theft,1100 e. 58th st. (ryerson laboratory),8/20/10 3:30 pm to 4:00 pm,8/20/10 7:08 pm,theft,2010-08-20 15:45:00,41.7901847,-87.60458489999999
security alarm activated / ucpd conducted premises check / all secure,activated alarm,1362 e. 59th st. (blaine hall),8/21/10 4:57 am,8/21/10 4:57 am,,2010-08-21 04:57:00,41.7854002,-87.60028299999999
ucpd officer found exterior door unlocked,irregular conditions,5800 s. stony island (doctors hospital),8/21/10 12:34 pm,8/21/10 12:34 pm,,2010-08-21 12:34:00,41.7846534,-87.60485700000001
man climbed boom of crane at construction site (apprx. 200 ft.)  / cpd negotiator communicated with the man / taken to hospital for psychological exam,criminal trespass to property,6019 s. dorchester (construction site),8/21/10 2:30 pm,8/21/10 2:55 pm,,2010-08-21 14:30:00,41.79662385,-87.60274899999999
ucpd officers arrested a man wanted on a warrant for violation of parole,warrant arrest,50th & cornell,8/21/10 8:43 pm,8/21/10 8:43 pm,,2010-08-21 20:43:00,41.7829115,-87.58651739999999
unknown person took unsecured bicycle parked on the sidewalk in front of store,theft,53rd at dorchester,8/21/10 11:00 pm,8/22/10 9:20 am,theft,2010-08-21 23:00:00,41.7888793,-87.6049986
two suspects attempted to steal bicycles / arrested by ucpd officers / suspect had knife in his possession,unlawful use of a weapon,cottage grove at 59th,8/22/10 10:50 am,8/22/10 11:00 am,,2010-08-22 10:50:00,41.7980572,-87.58906139999999
unknown person pried open tool box and took tools,theft,6011 s. ingleside (parking lot),8/20/10  to 8/23/10 5:00 pm to 9:30 am,8/23/10 2:31 pm,theft,,41.80502745,-87.6016111
cell phone taken from patient's room,theft,5721 s. maryland (comer hospital),8/22/10 11:00 am to 1:00 pm,8/23/10 3:56 pm,theft,2010-08-22 12:00:00,41.7879565,-87.6032073
unknown person took a dell laptop computer from an unlocked office,theft,1005 e. 60th st. (burton-judson court),8/24/10 9:45 am to 11:00 am,8/24/10 12:24 pm,theft,2010-08-24 10:22:30,41.788612799999996,-87.60611215
unauthorized male gained entry to secured area of building by forcing door / left premises after being confronted by a staff member,criminal trespass to land,6054 s. drexel (uc office bldg.),8/24/10 6:53 pm,8/24/10 6:56 pm,,2010-08-24 18:53:00,41.7993982,-87.6005285
"unknown person gained entry to apartment by undetermined means / took 3 computers, tv, canon camera, electric shaver",burglary,ingleside between 54th & 55th,8/24/10 6:15 pm to 9:15 pm,8/24/10 9:54 pm,burglary,2010-08-24 19:45:00,41.78318105,-87.6011243
"during the course of a verbal altercation, three men struck another man with their fists / arrest by ucpd",battery,stony island at 62nd,8/24/10 10:40 pm,8/24/10 10:53 pm,battery,2010-08-24 22:40:00,41.7857458,-87.5917819
woman walking in the parking structure tripped and fell injuring her face and right arm,injured person,5840 s. maryland (parking structure),8/25/10 9:15 am,8/25/10 9:42 am,,2010-08-25 09:15:00,41.7916469,-87.6034081
man reports loaning money to a stranger on the street who promised repayment / loan not repaid,miscellaneous,54th & harper,8/21/10 4:00 pm,8/25/10 9:46 am,,2010-08-21 16:00:00,41.8104878,-87.5929355
unknown person smashed front passenger's side window of car parked on the street and took an i-pod,theft from motor vehicle,ellis between 49th & 50th,8/24/10 to 8/25/10 9:30 pm to 10:00 am,8/25/10 10:29 am,theft,,41.789455,-87.60623900000002
dell desk top computer taken from office,theft,920 e. 59th st. (ucmc),8/20/10 to 8/24/10 4:00 pm to 2:00 pm,8/25/10 10:48 am,theft,,41.794242600000004,-87.58513769999999
ucpd officers arrested a male subject for possession of heroin / turned over to cpd,possession of controlled substance,cottage grove between 58th & 59th,8/25/10 11:05 pm,8/25/10 11:05 pm,,2010-08-25 23:05:00,41.7951617,-87.58947334999999
kitchen window broken in unoccupied dwelling unit,criminal damage to property,53rd between ellis & greenwood,8/24/10 to 8/25/10 4:45 pm to 11:20 pm,8/26/10 12:07 am,,,41.803627,-87.72159479999999
"unknown male entered residence via rear window, took i-pod and wallet / suspect fled from rear parking area when observed by complainant / wallet recovered",burglary,ellis between 61st & 62nd,8/26/10 6:30 am,8/26/10 7:34 am,burglary,2010-08-26 06:30:00,41.78715985,-87.63908525
smoke from over-cooked food triggered smoke detector / no fire / cfd responded,fire alarm,1365 e. 60th st. (orthogenic school),8/26/10 12:24 pm,8/26/10 12:24 pm,,2010-08-26 12:24:00,41.79604049999999,-87.59080850000001
change purse fell from woman's pocket while in washroom / change purse found in washroom by staff member and returned to owner / $98 missing,theft,900 e. 57th st. (knapp center),8/26/10 7:30 am to 9:00 am,8/26/10 12:26 pm,theft,2010-08-26 08:15:00,41.78952109999999,-87.60424909999999
"unknown person(s) entered residence through an open window / took 52"" sharp tv, key, wine",burglary,greenwood near 62nd,8/26/10 7:50 am to 3:00 pm,8/26/10 6:30 pm,burglary,,41.7886079,-87.5987133
ex-boyfriend stalking and verbally harassing a woman / subject cautioned and warned not to trespass on uc property,stalking,58th at cottage grove,8/26/10 9:15 pm,8/26/10 10:12 pm,,2010-08-26 21:15:00,41.7841369,-87.6061299
"unknown person(s) gained entry to apartment via rear unlocked rear window / took 42"" panasonic tv, sony laptop computer, bicycle",burglary,cornell between 55th & 56th,8/26/10 to 8/27/10 7:05 pm to 2:15 am,8/27/10 2:32 am,burglary,,41.7892116,-87.60406619999999
two unknown males entered a grocery store / one distracted the clerk while the other took money from the cash register / both fled the store,theft,55th between cornell & hyde park,8/27/10 4:50 pm,8/27/10 4:58 pm,theft,2010-08-27 16:50:00,41.79515070000001,-87.60501535
"malfunctioning alarm, possibly due to high humidity / cfd responded",fire alarm,5445 s. ingleside (maclean house),8/27/10 9:25 pm,8/27/10 9:25 pm,,2010-08-27 21:25:00,41.792279,-87.599954
ucpd officer arrested man wanted on a warrant,warrant,midway pl. near drexel,8/27/10 11:45 pm,8/27/10 11:45 pm,,2010-08-27 23:45:00,41.786834,-87.5988574
unattended cell phone taken by unknown person,theft,59th between kimbark & kenwood,8/28/10 2:00 am  to 2:30 am,8/28/10 6:53 am,theft,2010-08-28 02:15:00,41.7860807,-87.5909115
ucpd officers arrested two male subjects wanted by cpd for robbery,arrest,blackstone between 52nd & 53rd,8/28/10 8:53 pm,8/28/10 8:53 pm,,2010-08-28 20:53:00,41.7897352,-87.6015376
patient missing from mitchell emergency room - located by cpd and returned unharmed at 11:30 pm,missing person,901 e. 58th st. (mitchell er),8/28/10 5:00 pm to 6:30 pm,8/28/10 9:25 pm,,2010-08-28 17:45:00,41.7895621,-87.601259
unknown male walked into kitchen of apartment via unlocked door / fled when confronted by residents,criminal trespass to residence,university between 54th & 55th,8/29/10 12:20 am,8/29/10 12:26 am,,2010-08-29 00:20:00,41.79952055,-87.59746945
ucpd officer recovered an unoccupied vehicle reported stolen in another area of the city,recovered vehicle,cottage grove at 61st,8/29/10 1:28 am,8/29/10 1:28 am,,2010-08-29 01:28:00,41.800392,-87.606461
patient missing from the hospital treatment area,missing person,5815 s. maryland (mitchell hospital),8/29/10 7:30 pm,8/29/10 8:36 pm,,2010-08-29 19:30:00,41.79457499999999,-87.601637
ucpd officer arrested a man wanted on warrants,warrant arrest,55th between cottage grove and drexel,8/29/10 10:45 pm,8/29/10 11:21 pm,,2010-08-29 22:45:00,41.7840745,-87.59057949999999
alarm accidently triggered by workmen / no fire / cfd responded,fire alarm,1100 e. 57th st. (regenstein library),8/30/10 7:01 am,8/30/10 7:01 am,,2010-08-30 07:01:00,41.7879118,-87.6008291
unknown person smashed rear passenger's side window of a car parked on the street,criminal damage to motor vehicle,university between 60th & 61st,8/28/10 to 8/30/10 12:00 pm to 8:00 am,8/30/10 8:17 am,,,41.7895199,-87.6043401
motorist struck an unoccupied university owned vehicle parked on the street / driver at fault refused to stop and provide required information,hit & run crash / property damage,60th between dorchester & blackstone,8/30/10 9:18 am,8/30/10 9:21 am,,2010-08-30 09:18:00,41.7888793,-87.6049986
wallet taken from purse placed on the back of a chair as complainant sat at the counter in the café,theft,970 e. 58th st. (bookstore),8/30/10 12:30 pm to 1:00 pm,8/30/10 1:10 pm,theft,2010-08-30 12:45:00,,
woman fell on steps injuring her face and shin of her right leg / declined medical attention,injured person,1108 e. 58th st. (rosenwald hall),8/30/10 2:00 pm,8/30/10 2:01 pm,,2010-08-30 14:00:00,41.7897352,-87.6015376
ucpd officers arrested a male subject wanted on a warrant,warrant arrest,53rd between university & woodlawn,8/30/10 5:00 pm,8/30/10 5:00 pm,,2010-08-30 17:00:00,41.7994991,-87.5995121
ucpd officers arrested male subject for possession of marijuana / turned over to cpd,possession of cannabis,cottage grove at 52nd,8/30/10 5:00 pm,8/30/10 5:00 pm,,2010-08-30 17:00:00,41.7892116,-87.60406619999999
woman freed from stuck elevator by facilities and cfd,irregular conditions,5505 s. ellis (parking structure),8/30/10 7:51 pm,8/30/10 7:51 pm,,2010-08-30 19:51:00,41.79416215,-87.59490199999999
fire reported in a non-dwelling structure / cfd responded,fire,blackstone between 61st & 62nd,8/30/10 10:00 pm,8/30/10 10:06 pm,,2010-08-30 22:00:00,41.80684685,-87.6016453
ucpd officer touring building found office doors unsecured,irregular conditions,1010 e. 59th st. (harper library),8/31/10 12:10 am,8/31/10 12:10 am,,2010-08-31 00:10:00,41.78318105,-87.6011243
unknown male subject standing in the middle of the street threatened female motorist / subject gone on arrival of police,assault,58th between maryland & drexel,8/31/10 7:05 am,8/31/10 7:10 am,assault,2010-08-31 07:05:00,41.7846534,-87.60485700000001
"woman injured her foot on a ""concrete wheel stop"" on the 4th floor of the parking structure / declined medical attention",injured person,5840 s. maryland (parking structure),8/31/10 1:50 pm,8/31/10 2:01 pm,,2010-08-31 13:50:00,41.8911631,-87.62468659999999
secured bicycle taken from rear of apartment building,theft,kimbark between 51st & 52nd,7/31/10 to 8/30/10 5:00 pm to 10:30 am,8/31/10 2:34 pm,theft,,41.79954035,-87.59588355
man left the bookstore café without paying for food  / arrest,theft,970 e. 58th st. (bookstore),9/1/10 11:05 am,9/1/10 11:05 am,theft,2010-09-01 11:05:00,41.7888793,-87.6049986
man reports losing keys to his apartment,lost property,1100 e. 53rd st. (neighborhood residence),8/31/10 4:30 pm,9/1/10 6:06 pm,lost,2010-08-31 16:30:00,41.79728385,-87.59197309999999
patient misplaced cell phone,lost property,5815 s. maryland (mitchell hospital),9/1/10 8:00 am to 7:00 pm,9/1/10 8:02 pm,lost,,41.80490935,-87.58428509999999
unknown person smashed glass in rear door of residential building,criminal damage to property,kimbark between 55th & 56th,9/1/10 9:20 pm,9/1/10 9:24 pm,,2010-09-01 21:20:00,41.7950147,-87.60054964999999
ucpd officer arrested a male subject who had a handgun in his possession,unlawful use of a weapon,ellis between 48th & 49th,9/1/10 9:32 pm,9/1/10 9:32 pm,,2010-09-01 21:32:00,41.7878636,-87.60211729999999
"unknown person gained entry to apartment taking a laptop computer, backpack, cell phone, wallet, and keys / no signs of forced entry",burglary,ellis between 61st & 62nd,9/1/10 8:00 pm to 10:00 pm,9/1/10 10:21 pm,burglary,2010-09-01 21:00:00,41.7911305,-87.6027488
ucpd officer discovered exterior door did not properly secure / facilities notified,irregular conditions,6054 s. drexel (uc office bldg.),9/2/10 3:11 am,9/2/10 3:11 am,,2010-09-02 03:11:00,41.8019616,-87.59167049999999
man believes he lost a passport from his pocket while on north michigan av.,lost property,out of area - 500 n. michigan av.,8/26/10 to 8/27/10 9:00 am to 12:00 pm,9/2/10 9:20 am,lost,,41.7892116,-87.60406619999999
man implying he had a weapon demanded cash from a bank teller / subject took cash and fled,aggravated robbery,53rd between woodlawn & kimbark,9/2/10 1:50 pm,9/2/10 1:56 pm,robbery,2010-09-02 13:50:00,41.7940762,-87.60170769999999
witness observed a vehicle strike the rear bumper of a parked car while pulling into a parking space / information relayed to owner of the damaged vehicle,damage to property,5840 s. maryland (parking structure),9/2/10 2:10 pm,9/2/10 2:12 pm,,2010-09-02 14:10:00,41.800576050000004,-87.60399039999999
man smashed windows of two cars parked on the street and took gps devices / arrest by ucpd,theft from motor vehicle,dorchester between 51st & 52nd,9/2/10 3:40 pm,9/2/10 3:40 pm,theft,2010-09-02 15:40:00,41.7892116,-87.60406619999999
woman reported being physically abused on several occasions / provided with information and options relating to domestic violence,domestic battery,lakeshore dr. between 50th & 51st,6/11/10 10:00pm,9/2/10 3:50 pm,battery,2010-06-11 22:00:00,41.7882466,-87.5909896
unknown person took bicycle that was secured to a tree with a chain,theft,55th between ellis & greenwood,9/2/10 11:22 pm,9/2/10 11:22 pm,theft,2010-09-02 23:22:00,41.7919788,-87.5983645
apple i-pad taken from an unsecured cabinet in a secured office,theft,950 e. 59th st. (billings hospital),9/2/10 to 9/3/10 8:00 pm to 8:00 am,9/3/10 12:13 pm,theft,,41.794242600000004,-87.58513769999999
container of methylene chloride fell from a cart and spilled onto the sidewalk / cfd haz mat team responded / area secured and cleaned / safety responded,hazardous material incident,929 e. 57th st. (gordon center),9/3/10 2:45 pm,9/3/10 2:49 pm,,2010-09-03 14:45:00,41.9038751,-87.6287492
tenant reported an odor of gas in his apartment / pilot on stove was unlit / cfd responded,information,1401 e. hyde park (carlson hall),9/3/10 6:13 pm,9/3/10 6:14 pm,,2010-09-03 18:13:00,41.7932431,-87.59731055
man walking in corridor being cleaned slipped and fell injuring his right shoulder / received treatment at er,injured person,5815 s. maryland (mitchell hospital),9/3/10 5:00 pm,9/3/10 6:26 pm,,2010-09-03 17:00:00,41.7801956,-87.5974023
"unknown person took wallet, keys, and cell phone from an unsecured locker in men's locker room",theft,5530 s. ellis (ratner ac),9/3/10 6:20 pm to 7:10 pm,9/3/10 7:21 pm,theft,2010-09-03 18:45:00,41.79457499999999,-87.601637
unknown male armed with a handgun took money from a man on the street and shot him in the leg before fleeing,armed robbery,drexel between 50th & 51st,9/3/10 8:30 pm,9/3/10 8:57 pm,robbery,2010-09-03 20:30:00,41.784548,-87.600454
"visitor, who was creating a disturbance, verbally assaulted a nurse / removed from hospital",assault,5815 s. maryland (mitchell hospital),9/4/10 12:55 am,9/4/10 12:55 am,assault,2010-09-04 00:55:00,41.7912628,-87.59920819999999
alarm malfunction / no fire or smoke / cfd responded,fire alarm,1414 e. 59th st. (international house),9/4/10 1:44 am,9/4/10 1:44 am,,2010-09-04 01:44:00,41.78137245,-87.60248519999999
"unknown person entered residence by via rear door or window taking a 42"" tv, laptop computer, jewelry",burglary,52nd between greenwood & university,9/3/10 to 9/4/10 5:30 am to 12:30 am,9/4/10 1:45 am,burglary,,41.794242600000004,-87.58513769999999
smoke from cooking triggered alarm because staff neglected to utilize exhaust fans over grill / cfd responded,fire alarm,5640 s. university (bartlett commons),9/4/10 10:23 am,9/4/10 10:23 am,,2010-09-04 10:23:00,41.79948645,-87.5921654
"unknown person entered residence by forcing front door / took laptop computer, power book, i-pod, jewelry",burglary,cornell between 55th & 56th,9/4/10 9:50 am to 11:45 am,9/4/10 11:47 am,burglary,2010-09-04 10:47:30,41.7891768,-87.60195080000001
man lost wallet containing uc id card,lost property,out of area- division & state,9/4/10 1:00 am,9/4/10 3:27 pm,lost,2010-09-04 01:00:00,41.791942,-87.602839
"unknown person took laptop computer, air mattress and passport from unlocked vehicle parked on the street",theft from motor vehicle,56th between university & woodlawn,9/3/10 6:00 pm to 8:00 pm,9/4/10 7:11 pm,theft,2010-09-03 19:00:00,41.7893841,-87.5931651
alarm activated in public school building / checked exterior and notified cps staff,activated alarm,university at 64th,9/4/10 10:20 pm,9/4/10 10:20 pm,,2010-09-04 22:20:00,41.79517815,-87.60256249999999
southbound taxi turning left into parking structure struck a bicycle northbound on ellis / no injuries or property damage reported,traffic crash,5505 s. ellis,9/5/10 8:28 pm,9/5/10 8:28 pm,,2010-09-05 20:28:00,41.800576050000004,-87.60399039999999
false alarm / no smoke or fire detected / cfd responded,fire alarm,6051 s. ellis,9/5/10 11:52 pm,9/5/10 11:52 pm,,2010-09-05 23:52:00,41.7837227,-87.590271
ucpd officer found entry door unsecured / checked premises / facilities notified,irregular conditions,1101 e. 57th st. (zoology),9/6/10 12:35 am,9/6/10 12:35 am,,2010-09-06 00:35:00,41.787617,-87.61563855
three vehicles parked on the street struck by pellets,criminal damage to property,woodlawn between 62nd & 63rd,9/6/10 4:20 pm,9/6/10 5:18 pm,,2010-09-06 16:20:00,41.782291,-87.5994927
complainant reports receipt of unwanted phone calls after informing caller to desist,telephone harassment,cornell between 55th & 56th,9/5/10 4:51 pm,9/6/10 6:59 pm,,2010-09-05 16:51:00,41.792279,-87.599954
a man riding a bicycle grabbed a cell phone from the hand of a woman walking on the sidewalk and rode off,theft,53rd between kenwood & dorchester,8/31/10 9:00 pm,9/7/10 1:24 pm,theft,2010-08-31 21:00:00,41.7901516,-87.6010282
bicycle secured to bike rack with chain taken by unknown person,theft,5812 s. ellis (brain research pavilion),9/7/10 7:30 am to 6:30 pm,9/7/10 6:38 pm,theft,,41.792984,-87.6024664
radiation alarm activated / detection sensors showed negative results / area secure / hospital safety responded,activated alarm,924 e. 57th st. (biological sciences lc),9/8/10 4:49 am,9/8/10 4:49 am,,2010-09-08 04:49:00,41.794451,-87.59861540000001
bicycle chained to a bike rack taken by an unknown person,theft,5838 s. kenwood (lab school),9/8/10 8:00 am to 3:30 pm,9/8/10 5:32 pm,theft,,41.78962,-87.58657500000001
unknown person smashed passenger's side window of car parked on the street and took a gps devise,theft from motor vehicle,55th between drexel and ellis,9/8/10 9:00 am to 5:30 pm,9/8/10 5:55 pm,theft,,41.791551,-87.5867215
"unknown male approached a group of males in a park, fired a handgun striking victim in the left buttock / transported to hospital by cfd ems",aggravated battery,drexel between 50th & 51st,9/8/10 6:50 pm,9/8/10 6:52 pm,battery,2010-09-08 18:50:00,41.77901015,-87.6769668
fire alarm pump activated / no smoke or fire / cfd responded,fire alarm,6035 s. blackstone (south campus chiller plant),9/8/10 8:58 pm,9/8/10 8:58 pm,,2010-09-08 20:58:00,41.7886079,-87.5987133
"three males, one armed with a handgun, another with a knife, took a wallet from a man on the street and drove off in a maroon, 4-door cadillac / suspects detained by ucpd",armed robbery,59th between greenwood & university,9/8/10 10:48 pm,9/8/10 10:49 pm,robbery,2010-09-08 22:48:00,41.778763999999995,-87.6736032
ucpd officer arrested male subject for possession of an air rifle,weapons violation,greenwood at 62nd,9/9/10 8:23 pm,9/9/10 8:23 pm,,2010-09-09 20:23:00,41.7886421,-87.5927603
book taken from desk top in an unsecured area,theft,1100 e. 57th st. (regenstein library),9/9/10 to 9/10/10 4:30 pm to 8:30 am,9/10/10 10:53 am,theft,,41.7846534,-87.60485700000001
a container of chloroform was spilled on the 3rd floor / safety and cfd responded / area cleared at 1:55 pm,chemical spill,5747 s. ellis (jones lab),9/10/10 1:33 pm,9/10/10 1:33 pm,,2010-09-10 13:33:00,41.7801956,-87.5974023
staff members discovered a suspicious metal box with electrical wires attached / cpd bomb personnel investigated / harmless device,suspicious package,935 e. 56th st. (high energy physics),9/10/10 10:00 am,9/10/10 1:21 pm,,2010-09-10 10:00:00,41.7951368,-87.5935301
unauthorized male found sleeping in loading dock area / given trespass warning and released,criminal trespass to property,5514 s. university (pierce hall),9/11/10 10:21 am,9/11/10 10:21 am,,2010-09-11 10:21:00,41.7987785,-87.59487139999999
exterior door of vacant building found unlocked / facilities notified,irregular conditions,5800 s. stony island (doctors hospital),9/11/10 11:00 am,9/11/10 11:03 am,,2010-09-11 11:00:00,41.7892116,-87.60406619999999
ucpd officers saw man take a tire from a bike secured to a bicycle rack / arrest,theft,stony island at 57th,9/11/10 2:33 pm,9/11/10 2:33 pm,theft,2010-09-11 14:33:00,41.79356019999999,-87.5804228
unknown person smashed driver's side window and took gps device from a car parked on the street,theft from motor vehicle,midway pl. between cottage grove & drexel,9/11/10 12:00 pm to 10:05 pm,9/11/10 10:21 pm,theft,,41.79517815,-87.60256249999999
complainant observed a male committing a lewd act while sitting in a vehicle parked on the street / subject arrested by ucpd on 9/18/10,public indecency,university between 55th & 56th,9/12/10 9:00 am,9/12/10 9:03 am,,2010-09-12 09:00:00,41.7951805,-87.58803155
unknown person smashed passenger's side window of vehicle parked on the street and took gps device,theft from motor vehicle,midway pl. between drexel & ellis,9/12/10 2:30 pm to 11:30 pm,9/12/10 11:50 pm,theft,,41.7913676,-87.6018363
unknown person took cell phone from a back pack in a gym locker / uncertain if locker was secured,theft,5823 s. kenwood (sunny gym),9/7/10 2:24 pm to 4:30 pm,9/13/10 7:21 am,theft,2010-09-07 15:27:00,41.7901748,-87.59914119999999
unknown caller threatened to bomb police station,bomb threat,6054 s. drexel (ucpd hq),9/13/10 2:44 pm,9/13/10 2:44 pm,,2010-09-13 14:44:00,41.79055175,-87.59319895000002
three youths were stopped on the street by a youth armed with a weapon / suspect attempted to take a blackberry from one victim / arrest by ucpd / bb gun recovered from suspect,armed robbery,university at 64th,9/13/10 5:38 pm,9/13/10 5:38 pm,robbery,2010-09-13 17:38:00,41.7880702,-87.5956216
uc id card and driver's license lost on cta el train was found and held for owner,lost / found property,out of area - 55th & prairie,9/13/10 10:00 am,9/14/10 8:10 am,lost,2010-09-13 10:00:00,41.7929725,-87.59992779999999
unknown person gained entry to apartment via unsecured window / took laptop computer & cell phone,burglary,kimbark between 53rd & 54th,9/14/10 7:30 pm to 9:30 pm,9/14/10 11:36 pm,burglary,2010-09-14 20:30:00,41.795320950000004,-87.58939035
"complainant receiving harassing, unwanted messages from an individual",cyber stalking,5815 s. maryland (ucmc),9/13/10 to 9/15/10 various,9/15/10 2:23 pm,,,41.789927,-87.6028615
"two suspects, attempting to elude police, ran in the street through traffic causing a hazardous situation / arrest by ucpd",reckless conduct,south shore dr. at 56th,9/15/10 8:41 pm,9/15/10 8:41 pm,,2010-09-15 20:41:00,41.7876879,-87.60606159999999
woman sleeping in her bedroom was awakened by an unknown man poised over her / suspect fled when a roommate awoke and screamed / suspect took a laptop computer and other items from the residence,burglary,55th st. between drexel & ellis,9/16/10 1:15 am,9/16/10 1:27 am,burglary,2010-09-16 01:15:00,41.78841250000001,-87.60613939999999
"unknown person gained entry to residence via unsecured window / took gateway laptop computer, mac powerbook computer,  hp laptop computer, shoulder and messenger bags",burglary,55th between hyde park & everett,9/15/10 6:00 pm to 11:30 pm,9/16/10 8:36 am,burglary,2010-09-15 20:45:00,41.796645749999996,-87.6025519
unknown male grabbed a book and ran out of the store without paying,theft,970 e. 57th st. (bookstore),9/16/10 12:20 pm,9/16/10 12:23 pm,theft,2010-09-16 12:20:00,41.7905318,-87.5948216
worker fell from scaffolding at the rear of the building / transported to hospital by cfd ems,injured person,1100 e. 58th st. (ryerson hall),9/16/10 1:40 pm,9/16/10 1:45 pm,,2010-09-16 13:40:00,41.7886079,-87.5987133
male youth left home for school but did not attend class / youth later returned home unharmed,missing person,kenwood between 57th & 58th,9/16/10 7:50 am to 3:00 pm,9/16/10 4:00 pm,,,41.79865465,-87.60129275
5 xerox cartridges taken from room that may not have been secured,theft,1212 e. 59th st. (ida noyes hall),9/3/10 to 9/15/10 4:00 pm to 3:00 pm,9/16/10 4:19 pm,theft,,41.7964645,-87.60130104999999
unknown person took secured bicycle from bike rack,theft,1101 e. 56th st. (max palevsky commons),9/13/10 to 9/16/10 2:00 pm to 10:30 am,9/16/10 5:06 pm,theft,,41.7955918,-87.590176
1997 green dodge caravan taken from parking place on the street,theft of motor vehicle,55th between blackstone & harper,9/16/10 to 9/17/10 9:30 pm to 9:30 am,9/17/10 9:40 am,theft,,41.7845959,-87.6008803
staff member found camera bag containing batteries / turned over to cpd for safekeeping,found property,58th & university (quad),9/17/10 2:46 pm,9/17/10 2:46 pm,,2010-09-17 14:46:00,41.7968194,-87.603861
unknown person smashed window of car parked on the street and took gps device and coin purse,theft from motor vehicle,59th near woodlawn,9/17/10 0750 to 4:50 pm,9/17/10 4:54 pm,theft,,41.796480450000004,-87.59973879999998
2007 silver 4 dr. pontiac torrent taken from parking place on the street,theft of motor vehicle,cottage grove between 58th & 59th,9/17/10 3:00 pm to 5:00 pm,9/17/10 5:39 pm,theft,2010-09-17 16:00:00,41.796480450000004,-87.59973879999998
"unknown person entered residence via open kitchen window / took laptop computer, 2 video cameras, cell phone",burglary,54th pl. between drexel and ellis,9/17/10 6:30 pm to 8:30 pm,9/17/10 8:56 pm,burglary,2010-09-17 19:30:00,41.7994889,-87.5917812
"unknown person entered residence via an open window / took two mac laptop computers, canon eos camera, jewelry",burglary,kimbark between 57th & 58th,9/17/10 6:35 pm to 9:20 pm,9/17/10 9:42 pm,burglary,2010-09-17 19:57:30,41.788612799999996,-87.60611215
man observed committing an indecent act as he sat in his vehicle parked on the street / arrest by ucpd,public indecency,university between 55th & 56th,9/18/10 8:50 am,9/18/10 8:56 am,,2010-09-18 08:50:00,41.7892116,-87.60406619999999
ucpd officers questioning suspicious person in the alley found he possessed lock picks and other tools used in burglaries,possession of burglary tools,ellis between 53rd & 54th,9/18/10 1:40 pm,9/18/10 1:52 pm,burglary,2010-09-18 13:40:00,41.7858944,-87.60281069999999
unknown person bent front wheel and slashed tires of a bicycle secured to a city sign post,criminal damage to property,ellis between 54th & 55th,9/17/10 to 9/18/10 9:15 pm to 2:25 pm,9/18/10 2:35 pm,,,41.8101197,-87.6068689
unknown person smashed driver's side window of car parked on the street and took gps device,theft from motor vehicle,55th at blackstone,9/18/10 5:00 pm to 11:00 pm,9/18/10 11:11 pm,theft,,41.7965829,-87.59319099999999
unknown person took bicycle that had been secured to a bike rack,theft,6031 s. ellis (south campus residence hall),9/17/10 to 9/18/10 5:00 pm to 10:25 am,9/18/10 11:19 pm,theft,,41.78588655,-87.60361925
"unknown person entered residence via window / took laptop computer, wallet, jewelry",burglary,drexel at 54th,9/18/10 1:30 pm to 10:30 pm,9/19/10 12:20 am,burglary,,41.793282649999995,-87.59407429999999
unknown person(s) slashed four tires of car parked in parking lot,criminal damage to vehicle,greenwood between 54th & 55th,9/17/10 to 9/18/10 11:45 pm to 8:30 am,9/19/10 7:59 am,,,41.7880702,-87.5956216
unknown person(s) slashed four tires of car parked in parking lot,criminal damage to vehicle,greenwood between 54th & 55th,9/17/10 to 9/18/10 9:30 pm to 10:30 pm,9/19/10 11:30 am,,,41.79658934999999,-87.5918714
driver of rental van making a right turn struck a parked  ucpd vehicle / report by cpd,traffic crash,53rd at dorchester,9/19/10 3:49 pm,9/19/10 3:49 pm,,2010-09-19 15:49:00,41.7901847,-87.60458489999999
unknown person smashed window of car parked on the street and took two dvd players and two nintendo players,theft from motor vehicle,cottage grove between 58th & 59th,9/19/10 4:00 pm to 7:00 pm,9/19/10 7:37 pm,theft,2010-09-19 17:30:00,41.78282325,-87.60297309999999
"unknown person took white lab coat, 4g i-phone, and local anesthetic drug from secured room",theft,5815 s. maryland (ucmc),9/19/10 1:30 pm to 6:00 pm,9/19/10 9:55 pm,theft,2010-09-19 15:45:00,41.7855486,-87.6676319
two unknown males took a  shoulder bag and coat from a woman walking on the sidewalk,robbery,ingleside at 60th,9/20/10 3:30 pm,9/20/10 3:32 pm,robbery,2010-09-20 15:30:00,41.7951368,-87.5935301
"two men walking on the sidewalk wounded by gunfire from unknown person(s) in a passing vehicle / one man struck in the right foot, the other man struck in the lower left leg / taken to hospital by cfd ems",aggravated battery,cottage grove at 47th,9/20/10 8:25 pm,9/20/10 8:29 pm,battery,2010-09-20 20:25:00,41.7845959,-87.6008803
unsecured bicycle taken from basement of residential building,theft,blackstone between 54th & 55th,9/20/10 to 9/21/10 7:00 pm to 8:00 am,9/21/10 8:35 am,theft,,,
"unknown male, implying he was armed, attempted to take purse from woman walking on the sidewalk / woman screamed / suspect ran off",attempt aggravated robbery,60th between drexel & ingleside,9/21/10 9:20 am,9/21/10 9:28 am,robbery,2010-09-21 09:20:00,41.79433474999999,-87.5823006
unknown person smashed passenger's side window of a car parked on the street,criminal damage to vehicle,56th between kimbark & kenwood,9/19/10 to 9/20/10 7:00 am to 6:00 pm,9/21/10 11:14 am,,,41.794451,-87.59861540000001
wallet taken from woman's purse / subsequent unauthorized use of credit cards reported,theft,1212 e. 59th st. (ida noyes),9/21/10 9:30 am to 2:20 pm,9/21/10 5:15 pm,theft,2010-09-21 11:55:00,41.7846534,-87.60485700000001
unknown person gained entry to apartment via unlocked rear door / took two laptop computers and a computer monitor,burglary,kenwood between 54th & 55th,9/21/10 5:30 pm to 11:50 pm,9/21/10 11:58 pm,burglary,,41.7878636,-87.60211729999999
i-pod taken from a work bag left unattended in a triage room,theft,5721 s. maryland (comer hospital),9/21/10 7:00 am to 1:00 pm,9/22/10 7:56 pm,theft,,41.7850866,-87.6003224
wallet found by a citizen turned over to ucpd / owner retrieved property at ucpd hq,found property,ingleside between 61st & 62nd,9/22/10 7:45 am,9/22/10 8:15 am,,2010-09-22 07:45:00,41.7940762,-87.60170769999999
unknown person smashed window of vehicle parked on the street and took a gps device,theft from motor vehicle,midway pl. between harper & stony island,9/22/10 8:30 am to 12:30 pm,9/22/10 12:40 pm,theft,2010-09-22 10:30:00,41.7892417,-87.59749049999999
key ring and keys lost between 55th & shore drive and campus,lost property,55th & shore drive,9/21/10 9:00 am to 10:30 pm,9/22/10 1:02 pm,lost,,41.7940762,-87.60170769999999
unknown person took a bicycle that had been secured to a bike rack,theft,6031 s. ellis (south campus residence hall),9/18/10 to 9/19/10 9:00 pm to 11:00 am,9/22/10 2:24 pm,theft,,41.7691535,-87.67257705
man reports leaving his cell phone on a safe ride bus,lost property,61st at woodlawn,9/14/10 1:00 am,9/22/10 6:54 pm,lost,2010-09-14 01:00:00,41.7934028,-87.60085939999999
"unknown person entered residence via an open rear door / took two laptop computers, a ring, and cash",burglary,everett between 55th & 56th,9/22/10 5:00 pm to 8:00 pm,9/22/10 8:29 am,burglary,2010-09-22 18:30:00,41.7902573,-87.6007681
three individuals were discovered on the roof of the building by resident head / duty dean notified,suspicious activity,5514 s. university (pierce hall),9/23/10 1:00 am,9/23/10 1:11 am,,2010-09-23 01:00:00,41.7902573,-87.6007681
"damage to parkway sod, apparently by a large truck from construction site / turner construction notified",damage to property,6054 s. drexel (univ. office building),9/23/10 7:00 pm to 7:15 pm,9/23/10 7:32 pm,,2010-09-23 19:07:30,41.7916469,-87.6034081
male subject chased female staff member through hallways / apprehended by ucmc  public safety  / held for medical and psychological examinations,assault,950 e. 59th st. (billings hospital),9/23/10 7:50 pm,9/23/10 7:51 pm,assault,2010-09-23 19:50:00,41.7893749,-87.5931645
unknown person shattered driver's side window of car parked on the street,criminal damage to vehicle,midway pl. at ellis,9/23/10 7:00 am to 11:45 pm,9/23/10 11:45 pm,,,44.8871045,-104.89230624999999
unknown person took credit card from a wallet placed in an unattended purse in an office / unauthorized use of credit card subsequently reported,theft,5530 s. ellis (ratner ac),9/23/10 1:15 pm to 4:40 pm,9/23/10 11:40 pm,theft,2010-09-23 14:57:30,41.78936179999999,-87.5980201
unknown person carved men's room stall door / facilities notified,criminal damage to property,1155 e. 58th st. (oriental institute),9/23/10 to 9/24/10 7:00 am to 9:00 am,9/24/10 10:56 am,,,44.8871045,-104.89230624999999
wallet taken from an unattended book bag placed against a wall,theft,5530 s. ellis (ratner ac),9/24/10 10:00 am to 10:45 am,9/24/10 12:35 pm,theft,2010-09-24 10:22:30,41.79457499999999,-87.601637
male arrested by ucpd for disorderly conduct and an active arrest warrant,public peace violation,midway pl. between greenwood and university,9/25/10 4:00 pm,9/25/10 4:08 pm,,2010-09-25 16:00:00,41.8002578,-87.59671449999999
"no fire, no smoke, cfd responded / alarm malfunction",fire alarm,5555 s. ellis (young bldg.),9/26/10 4:43 am,9/26/10 4:43 am,,2010-09-26 04:43:00,41.7893925,-87.5947956
woman reports losing cell phone at a party,lost property,university between 56th & 57th,9/26/10 2:30 am to 3:30 am,9/26/10 1:34 pm,lost,2010-09-26 03:00:00,41.7951368,-87.5935301
man reports losing wallet / perhaps in a taxi,lost property,university between 56th & 57th,9/22/10 to 9/23/10 9:00 pm to 5:00 am,9/26/10 4:09 pm,lost,,41.79582515,-87.60619935
ucpd officers arrested a man wanted on an active warrant,warrant arrest,cottage grove between  57th & 58th,9/27/10 2:57 am,9/27/10 2:57 am,,2010-09-27 02:57:00,41.7897352,-87.6015376
unknown person took cash from a desk in secured office,theft,5840 s. kenwood (lab school),9/9/10 to 9/10/10 4:30 pm to 8:30 am,9/27/10 7:47 am,theft,,41.788344,-87.60090319999999
unknown person forced entry via basement door / no property loss at this time,burglary,50th between kimbark & kenwood,9/27/10 9:00 am to 9:30 am,9/27/10 1:42 pm,burglary,2010-09-27 09:15:00,41.7891387,-87.5954555
unknown person forced entry to apartment and took cash,burglary,everett between 54th & 55th,9/27/10 10:00 am to 12:45 pm,9/27/10 1:20 pm,burglary,2010-09-27 11:22:30,41.79662385,-87.60274899999999
woman reports an unknown man was giving her unwanted attention,suspicious person,5800 s. university (quad),9/27/2010 10:00,9/27/10 2:58 pm,,2010-09-27 10:00:00,41.79150975,-87.58863249999999
unknown person forced entry to residence and took 2 computers,burglary,everett between 54th & 55th,9/27/10 8:00 am to 4:00 pm,9/27/10 4:11 pm,burglary,,41.7904115,-87.6009517
cfd responded and freed people from a stuck elevator,stuck elevator,5505 s. ellis (parking structure),9/27/10 7:13 pm,9/27/10 7:13 pm,,2010-09-27 19:13:00,41.7911305,-87.6027488
three unknown males were seen breaking the exit gate arm at the parking garage,criminal damage to property,5807 s woodlawn (booth school),9/28/10 12:37 am,9/28/10 12:37 am,,2010-09-28 00:37:00,41.7902573,-87.6007681
unknown person entered apartment and took a dell laptop computer / no signs of forced entry,burglary,woodlawn between 52nd & 53rd,9/27/10 to 9/28/10 11:30 pm to 7:30 am,9/28/10 8:15 am,burglary,,41.79102779999999,-87.59674919999999
unknown person took bicycle that had been secured to a bike rack,theft,5814 s. kimbark (lab school),9/27/10 to 9/28/10 9:30 am to 9:10 am,9/28/10 9:17 am,theft,,41.7903948,-87.6038772
ucpd observed a man taking a tire from a parked car / arrested after a chase,theft,55th at cottage grove,9/28/10 10:12 am,9/28/10 10:14 am,theft,2010-09-28 10:12:00,41.7929725,-87.59992779999999
suspect being chased by police ran into the side of a moving vehicle as he attempted to elude police / minor injury,traffic accident / personal injury,cottage grove between 54th & 55th,9/28/2010 10:48,9/28/10 10:49 am,,2010-09-28 10:48:00,41.7916469,-87.6034081
man grabbed approximately 10 sweatshirts and ran from the store without paying / subject arrested by ucpd 10/22/10,retail theft,970 e. 58th st. (bookstore),9/29/10 12:31 pm,9/29/10 12:31 pm,theft,2010-09-29 12:31:00,41.7882466,-87.5909896
unknown person took unattended wallet containing cash and credit cards from an unlocked office / subsequent unauthorized use of credit cards reported,theft,5845 s. ellis (gates hall),9/29/10 10:30 am to 1:30 pm,9/29/10 1:51 pm,theft,2010-09-29 12:00:00,41.7926519,-87.604581
unauthorized man disregarded previous warnings and was arrested for trespass by ucpd,criminal trespass to property,5807 s. woodlawn (booth school),9/29/10 4:45 pm,9/29/10 4:58 pm,,2010-09-29 16:45:00,41.78318105,-87.6011243
unknown person broke lock on a residential basement door to gain entry and took miscellaneous tools from a basement locker,burglary,ingleside between 54th & 55th,9/20/10 to 9/21/10 10:00 pm to 9:00 am,9/29/10 4:59 pm,burglary,,41.792279,-87.599954
unknown person entered apartment and took a macbook laptop computer / means of entry unknown,burglary,57th between harper & lake park,9/29/10 8:00 pm to 9:45 pm,9/29/10 9:52 pm,burglary,2010-09-29 20:52:30,41.7964645,-87.60130104999999
male subject struck another male in the face with his fist / victim declined to press charges at this time,battery,university between 57th & 58th,9/30/10 1:20 am,9/30/10 1:23 am,battery,2010-09-30 01:20:00,41.80866795,-87.6016785
"unknown person took 32"" lg flat screen tv from an unlocked case in the basement of the building",theft,929 e. 57th st. (gcis),9/20/10 to 9/22/10 5:00 pm to 10:30 am,9/30/10 10:14 am,theft,,41.80866795,-87.6016785
unknown person(s) threw rocks and broke a window pane at front of the residence,criminal damage to property,university between 56th & 57th,9/30/10 12:00 am to 6:00 am,9/30/10 2:00 pm,,,41.800082950000004,-87.60426819999999
unknown person took a mac book pro computer from a desk top,theft,5710 s. woodlawn (multi-cultural affairs),9/30/10 9:00 pm to 9:20 pm,9/30/10 9:41 pm,theft,2010-09-30 21:10:00,41.800082950000004,-87.60426819999999
woman created a disturbance in er and refused requests to act in a responsible manner / arrested by ucpd,disorderly conduct,5730 s. drexel (comer er),10/1/10 2:20 am,10/1/10 2:20 am,,2010-10-01 02:20:00,41.7895621,-87.601259
unknown person(s) painted graffiti on wall in garden area / facilities notified,criminal damage to property,1101 e. 56th st. (max palevsky commons),9/29/10 to 10/1/10 6:00 pm to 9:50 am,10/1/10 9:51 am,,,41.7955222,-87.5880933
unknown person took a black mesh desk sorter from a desk,theft,900 e. 57th st. (knapp center),9/27/10 to 9/28/10 4:30 pm to 8:00 am,10/1/10 10:27 am,theft,,41.7931965,-87.6013394
complainant reported receiving a fraudulent check as part of a confidence game wire scam,deceptive practice,1414 e. 59th st. (international house),9/29/10 2:00 pm,10/1/10 2:11 pm,,2010-09-29 14:00:00,41.7878418,-87.59150869999999
alarm activated / door not secured / ucpd toured and secured building / alarm reset,activated alarm,5617 s. maryland (facilities plant),10/1/10 10:36 pm,10/1/10 10:36 pm,,2010-10-01 22:36:00,41.7919788,-87.5983645
ucpd  responded to a call of an intoxicated person on the street /  cfd arrived and transported underage person to hospital for observation,liquor law violation,ellis between 61st & 62nd,10/2/10 12:05 am,10/2/10 12:07 am,,2010-10-02 00:05:00,41.7965829,-87.59319099999999
unknown person took wallet from unattended backpack / subsequent unauthorized use of credit card reported,theft,1100 e. 57th st. (regenstein library),10/1/10 to 10/2/10 12:01 am to 9:00 am,10/2/10 10:24 am,theft,,41.7889722,-87.59926279999999
unknown person gained entry to residence via unlocked bedroom window / took three mac pro laptop computers,burglary,ellis between 54th & 55th,10/2/10 5:50 pm to 8:45 pm,10/2/10 8:57 pm,burglary,2010-10-02 19:17:30,41.7854002,-87.60028299999999
ucpd officers arrested a male for striking his female companion in the face with his fist,battery,ellis between 47th & 48th,10/3/10 1:15 am,10/3/10 1:15 am,battery,2010-10-03 01:15:00,41.78328375,-87.59140335
complainant found bullet broke 2nd floor side window of apartment / unable to determine when damage occurred,criminal damage to property,ellis between 47th & 48th,unknown,10/3/10 1:05 pm,,,41.78960720000001,-87.5964144
ucpd officers arrested a man for trespass to property and possession of burglary tools,criminal trespass to property,drexel between 52nd & 53rd,10/3/10 7:39 pm,10/3/10 7:39 pm,,2010-10-03 19:39:00,41.7900088,-87.60020999999999
"man forced entry to apartment via front door / took i-pod nano, blackberry phone charger, and clothing / articles recovered during investigation of suspect arrested by ucpd report w1186",burglary,drexel between 52nd & 53rd,10/3/10 9:30 pm,10/4/10 12:24 am,burglary,2010-10-03 21:30:00,41.7901847,-87.60458489999999
cell phone was found in eckhart library and placed in lost and found / unknown person removed the cell phone from lost and found,theft,1118 e. 58th st. (eckhart),10/3/10 to 10/4/10 7:00 pm to 9:10 am,10/4/10 9:53 am,theft,,41.78802779999999,-87.5939404
man reports losing his wallet in the area of 55th & lake park,lost property,lake park at 55th,10/2/10 3:00 pm to 3:30 pm,10/5/10 9:17 am,lost,2010-10-02 15:15:00,41.7804767,-87.59916
unknown person took a bicycle that had been secured to a bike rack,theft,ellis at 56th,10/4/10 12:00 pm to 5:30 pm,10/5/10 10:21 am,theft,2010-10-04 14:45:00,41.79562455,-87.5975152
woman lost her south african passport,lost property,59th at dorchester,9/25/10 to 9/26/10  8:00 pm to 9:00 am,10/5/10 12:05 pm,lost,,41.7886079,-87.5987133
woman left her wallet in dining hall / subsequent unauthorized use of a debit card reported,theft,5640 s. university (bartlett dining hall),10/4/10 1:00 pm to 1:30 pm,10/5/10 12:05 pm,theft,2010-10-04 13:15:00,41.792279,-87.599954
unknown person took an unsecured bicycle from the rear yard of a residence,theft,blackstone between 54th & 55th,10/5/10 to 10/6/10 9:00 pm to 8:45 am,10/6/10 9:49 am,theft,,41.7997066,-87.6045913
woman tripped and fell striking her head on the sidewalk / declined medical attention,injured person,1101 e. 58th st. (rosenwald hall),10/6/10 11:50 am,10/6/10 11:50 am,,2010-10-06 11:50:00,41.80490935,-87.58428509999999
unknown person took a secured bicycle from the bike rack in the basement of the residence hall,theft,1005 e. 60th st. (burton-judson),6/10/10 to 9/10/10 6:00 pm to 11:00 am,10/6/10 12:05 pm,theft,,41.7949533,-87.58937854999999
a male youth displayed a knife and took a bicycle from another youth on the street / suspect arrested by ucpd,armed robbery,dorchester between 61st & 62nd,10/6/10 4:29 pm,10/6/10 4:31 pm,robbery,2010-10-06 16:29:00,41.7945519,-87.59001395
unknown male snatched an apple laptop computer from a man sitting on a bench and ran off,theft,1117 e. 58th st. (quad),10/6/10 5:20 pm,10/6/10 5:27 pm,theft,2010-10-06 17:20:00,41.7894044,-87.59280660000002
unknown person took a bicycle that had been secured to a bike rack,theft,1020 e. 58th st. (kent hall),10/5/10 1:30 pm to 5:30 pm,10/6/10 7:36 pm,theft,2010-10-05 15:30:00,41.792279,-87.599954
unknown male threatened staff member placing him in fear of physical harm / suspect left before police arrived,assault,5721 s. maryland (comer hospital),10/6/10 8:25 pm,10/6/10 8:30 pm,assault,2010-10-06 20:25:00,41.78986500000001,-87.6027639
lab school student lost a violin while in the school,lost property,1362 e. 59th st. (lab school),10/1/10 8:30 am to 2:30 pm,10/7/10 3:12 pm,lost,,41.789113,-87.600152
three males used force to take $100 from a man walking on the street / two suspects arrested by ucpd,robbery,greenwood at 63rd,10/7/10 4:14 pm,10/7/10 4:14 pm,robbery,2010-10-07 16:14:00,41.7933325,-87.58964929999999
"unknown person(s) entered residence by breaking glass in front door / took tv, computers, and other property",burglary,hyde park between university and woodlawn,10/1/10 to 10/7/10  2:00 pm to 5:40 pm,10/7/10 5:41 pm,burglary,,41.78552,-87.6018945
complaint of people being loud and disorderly on the street / group dispersed upon arrival of police,disturbance,university at 61st,10/8/10 1:23 am,10/8/10 1:23 am,,2010-10-08 01:23:00,41.7904248,-87.60613515
graffiti spray painted on exterior concrete wall / facilities notified / arrest by ucpd / refer to w1211 below,criminal damage to property,1100 e. 57th st. (regenstein library),10/7/10 6:00 pm,10/8/10 9:20 am,,2010-10-07 18:00:00,41.786834,-87.5988574
"man reported he heard a person at his back door / when complainant went to the door, the man ran off",suspicious person,drexel between 53rd & 54th,10/8/10 10:50 am,10/8/10 10:53 am,,2010-10-08 10:50:00,41.792279,-87.599954
man reported he received a fraudulent check in return for a security deposit / complainant declined to sign a complaint when other arrangements were made for return of funds,deceptive practice,lake shore dr. between 50th & 51st,10/2/10 2:00 pm to 7:00 pm,10/8/10 11:24 am,,2010-10-02 16:30:00,41.78952109999999,-87.60424909999999
woman reported loss of her wallet between 51st & blackstone and 53rd & harper,lost property,hyde park between blackstone & harper,10/6/10 3:10 pm,10/8/10 2:38 pm,lost,2010-10-06 15:10:00,41.7889661,-87.60093189999999
complainant discovered someone used his credit card information to purchase items,theft,blackstone between 55th & 56th,10/7/10 4:00 pm,10/8/10 3:33 pm,theft,2010-10-07 16:00:00,41.78324815,-87.59471155
